,tweet_id,name,screen_name,retweet_count,text,created_at,favourite_count,hashtags,status_count,location,source_device,retweet_text,quote_text,quote_screen_name
744,879890802700427268,Life Without Plastic,LifeWoutPlastic,0,"#Repost: @mobotnation 
···
“ Let's help reduce this #plasticpollutes 🙏🏼
If you're in Santa… https://t.co/c6vTeSlIOy",2017-06-28 02:34:49,1,"[{'text': 'Repost', 'indices': [0, 7]}, {'text': 'plasticpollutes', 'indices': [52, 68]}]",2971,,Instagram,None,None,None
745,879352322584956929,Life Without Plastic,LifeWoutPlastic,11,Be a part of the change! Peace Out Plastics Beach clean up in Santa Barbara Jul 1 at 10:30 ! https://t.co/j8tr4t3lwf https://t.co/jToXA0HmWc,2017-06-26 14:55:05,10,[],2971,,Hootsuite,None,None,None
746,879033967877513216,Life Without Plastic,LifeWoutPlastic,0,"Peace Out Plastics Santa Barb Jun 29 6-9pm.  Come 4 inspiration, food, drink, music, raffle, plastic-free swag! tix: https://t.co/FubL0yrT6e",2017-06-25 17:50:04,3,[],2971,,Hootsuite,None,None,None
747,878647984233336832,Life Without Plastic,LifeWoutPlastic,1,Our pop-up in Brooklyn at packagefreeshop ! We're so excited to be here! Come and say… https://t.co/gxGNGF7AnA,2017-06-24 16:16:18,6,[],2971,,Instagram,None,None,None
748,878402893732335620,Life Without Plastic,LifeWoutPlastic,1,"#Repost: @BetterWorldSrs 
···
“ Ok, how can you not want EVERYTHING from @LifeWoutPlastic!? A… https://t.co/7A0Afy7quL",2017-06-24 00:02:24,3,"[{'text': 'Repost', 'indices': [0, 7]}]",2971,,Instagram,None,None,None
749,878031475878252545,Life Without Plastic,LifeWoutPlastic,3,A great summer treat! The Freezycup is on sale until the end of June. It is an individual… https://t.co/mOUokUrQb9,2017-06-22 23:26:31,1,[],2971,,Instagram,None,None,None
750,877952600951332865,Life Without Plastic,LifeWoutPlastic,0,Discover the Many Ways to Enjoy a Summer Treat in this week's Newsletter -  https://t.co/EGjTyuJWzD,2017-06-22 18:13:06,3,[],2971,,Mailchimp,None,None,None
751,877915148765114368,Life Without Plastic,LifeWoutPlastic,2,"2 Days until our POP-UP in @packagefreeshop! If you're in Brooklyn this Sat June 24, come say Hi and stick around for specials and giveaways https://t.co/k2wbO1Urpf",2017-06-22 15:44:16,6,[],2971,,Twitter Web Client,None,None,None
752,877645729728045057,Life Without Plastic,LifeWoutPlastic,0,"6/24 @ 11:00 am | A Life Without Plastic Pop Up Inside packagefreeshop : Come and meet us,… https://t.co/1JSOxTI6ex",2017-06-21 21:53:42,1,[],2971,,Instagram,None,None,None
753,877184740440330240,Life Without Plastic,LifeWoutPlastic,2,That day when 800+ NGOs told @AmChemistry: there’s only one solution: #breakfreefromplastic: https://t.co/LEVAAR8lrt https://t.co/MyUMv0WaCc,2017-06-20 15:21:54,9,"[{'text': 'breakfreefromplastic', 'indices': [70, 91]}]",2971,,Twitter Web Client,None,None,None
754,877180008619532288,Life Without Plastic,LifeWoutPlastic,2,New natural GMO-free soap bars plus FREE SHIPPING on orders over 85$ until Jun 21 (to Canada &amp; continental U.S.) use code:FREESHIPPING85 https://t.co/6k5N2snxpV,2017-06-20 15:03:05,1,[],2971,,Twitter Web Client,None,None,None
755,876908379255353344,Life Without Plastic,LifeWoutPlastic,3,Plastic pollution in the Antarctic worse than expected https://t.co/VQL4einsvl via @physorg_com,2017-06-19 21:03:44,0,[],2971,,Twitter Web Client,None,None,None
756,876159262044639233,Life Without Plastic,LifeWoutPlastic,0,"This time of year, you want to send a clear message to hungry bugs that you're not a delicious… https://t.co/0z7ZRvPiez",2017-06-17 19:27:00,6,[],2971,,Instagram,None,None,None
757,876157098425544704,Life Without Plastic,LifeWoutPlastic,0,"This time of year, you want to send a clear message to hungry bugs that you're not a delicious… https://t.co/bp9caS6nyZ",2017-06-17 19:18:25,2,[],2971,,Instagram,None,None,None
758,875074757129056256,Life Without Plastic,LifeWoutPlastic,1,Enjoy free shipping on orders $85.00 and above until June 21st with coupon code… https://t.co/M5HksjqbBM,2017-06-14 19:37:34,0,[],2971,,Instagram,None,None,None
759,875072678541000706,Life Without Plastic,LifeWoutPlastic,0,Have you Heard the Everything Bar? And Free Shipping -  https://t.co/Xo5q8VoPtv,2017-06-14 19:29:19,1,[],2971,,Mailchimp,None,None,None
760,874750370110738434,Life Without Plastic,LifeWoutPlastic,0,Renting a giant rubber duck to celebrate Canada's 150th is silly and irresponsible: https://t.co/Zl8P7r07kx,2017-06-13 22:08:34,2,[],2971,,Twitter Web Client,None,None,None
761,874432850992521216,Life Without Plastic,LifeWoutPlastic,2,"#Repost: earthinusa via @renstapp 
···
“ You may say I'm a dreamer but I'm not the only one… https://t.co/d4KzZWn7hO",2017-06-13 01:06:52,1,"[{'text': 'Repost', 'indices': [0, 7]}]",2971,,Instagram,None,None,None
762,874277476914130945,Life Without Plastic,LifeWoutPlastic,3,"10 Ways to Reduce Your Plastic Footprint While on Vacation in Costa Rica!
https://t.co/0GuiJg6TLM",2017-06-12 14:49:28,9,[],2971,,Twitter Web Client,None,None,None
763,873257041292402688,Life Without Plastic,LifeWoutPlastic,8,New study finds 1.15 to 2.41 million metric tons of plastic enter oceans from rivers https://t.co/zsYrXBo3Ja,2017-06-09 19:14:37,7,[],2971,,Twitter Web Client,None,None,None
764,873187217094717440,Life Without Plastic,LifeWoutPlastic,1,Need a leak-proof lunch container? We've got you covered! https://t.co/exU3omW9eT #zerowaste #lifewithoutplastic #Health https://t.co/DPQIKwJhlb,2017-06-09 14:37:10,2,"[{'text': 'zerowaste', 'indices': [82, 92]}, {'text': 'lifewithoutplastic', 'indices': [93, 112]}, {'text': 'Health', 'indices': [113, 120]}]",2971,,Twitter Web Client,None,None,None
765,872925524460527621,Life Without Plastic,LifeWoutPlastic,0,You get this great glass bottle at the store with a delicious fizzy drink inside but when you're… https://t.co/pIjucctsjy,2017-06-08 21:17:17,0,[],2971,,Instagram,None,None,None
766,872809247611998208,Life Without Plastic,LifeWoutPlastic,8,"Happy world oceans day! Here's to another year of great efforts to protect, preserve and push towards a plastic-free future! https://t.co/S8rq2Lj0ia",2017-06-08 13:35:15,13,[],2971,,Hootsuite,None,None,None
767,871804213763997696,Life Without Plastic,LifeWoutPlastic,8,Every little bit helps 🌱 Bags are an easy way to start! https://t.co/cWC7HyomAS https://t.co/TjJ7bBRstK,2017-06-05 19:01:36,10,[],2971,,Twitter Web Client,None,None,None
768,871802707786571782,Life Without Plastic,LifeWoutPlastic,1,Happy World Environment Day 🌿,2017-06-05 18:55:37,6,[],2971,,Twitter Web Client,None,None,None
769,871553788770996225,Life Without Plastic,LifeWoutPlastic,4,Plastic straws stir up environmental debate in Berkeley https://t.co/V4xAuHV7gr via @sfchronicle,2017-06-05 02:26:30,7,[],2971,,Twitter Web Client,None,None,None
770,871553579756265472,Life Without Plastic,LifeWoutPlastic,7,De Blasio floats plastic bag ban in NYC https://t.co/ZoN28XgnWP via @Newsday,2017-06-05 02:25:40,12,[],2971,,Twitter Web Client,None,None,None
771,871551019792179200,Life Without Plastic,LifeWoutPlastic,11,"Magnificent Margaret Atwood: Plastics are poisoning us. We need change, now https://t.co/i2gWQJoDMw  Our comment: A plastic-free Hallelujah!",2017-06-05 02:15:30,15,[],2971,,Twitter Web Client,None,None,None
772,871503282908397568,Life Without Plastic,LifeWoutPlastic,17,Why plastic straws should be taxed: https://t.co/yZk8AVL9kJ,2017-06-04 23:05:49,25,[],2971,,Twitter Web Client,None,None,None
773,871479919137738752,Life Without Plastic,LifeWoutPlastic,4,G20 agrees on plan to reduce plastic in oceans https://t.co/bLY10kOMJO via @dwnews,2017-06-04 21:32:58,9,[],2971,,Twitter Web Client,None,None,None
774,871448093404930050,Life Without Plastic,LifeWoutPlastic,10,Sweden gears up for tougher measures against plastic waste https://t.co/ug15yFxV6q via @TheLocalSweden,2017-06-04 19:26:30,19,[],2971,,Twitter Web Client,None,None,None
775,870345285477818368,Life Without Plastic,LifeWoutPlastic,1,We found the perfect friend for our all natural toothbrush!! Introducing natural silk floss in a… https://t.co/RaA3xLQVBV,2017-06-01 18:24:20,3,[],2971,,Instagram,None,None,None
776,869216775535243264,Life Without Plastic,LifeWoutPlastic,1,I'm so much more than just a glass bottle... https://t.co/fQKpWsznOB https://t.co/vReRwgyTsl,2017-05-29 15:40:03,6,[],2971,,Twitter Web Client,None,None,None
777,867842140004417536,Life Without Plastic,LifeWoutPlastic,0,Just got in our beautiful new double wall infuser with bamboo cap! #lifewithoutplastic #tea #zerowaste https://t.co/rLcJeYoaJ4 https://t.co/ndsUVrbblz,2017-05-25 20:37:44,6,"[{'text': 'lifewithoutplastic', 'indices': [67, 86]}, {'text': 'tea', 'indices': [87, 91]}, {'text': 'zerowaste', 'indices': [92, 102]}]",2971,,Twitter Web Client,None,None,None
778,866653710369394688,Life Without Plastic,LifeWoutPlastic,9,'Recycling in Australia is dead in the water': three companies tackling our plastic addiction https://t.co/JcyoLF6OWK,2017-05-22 13:55:20,9,[],2971,,Twitter Web Client,None,None,None
779,866435136539287553,Life Without Plastic,LifeWoutPlastic,0,"Using stainless steel pie plates for our home made quiches this weekend. Deep 10"" pie plates… https://t.co/xHi4LTCBu9",2017-05-21 23:26:48,4,[],2971,,Instagram,None,None,None
780,865626809953509377,Life Without Plastic,LifeWoutPlastic,3,"Join @PlasticOceans 4 #WorldOceansDay (June 8) in #MTL - screening #APlasticOcean, talks, &amp; Plastic-Free Expo! Free@ https://t.co/ricO8qWCxH https://t.co/hT8MHpNV9M",2017-05-19 17:54:48,7,"[{'text': 'WorldOceansDay', 'indices': [22, 37]}, {'text': 'MTL', 'indices': [50, 54]}, {'text': 'APlasticOcean', 'indices': [67, 81]}]",2971,,Twitter Web Client,None,None,None
781,865581702541963265,Life Without Plastic,LifeWoutPlastic,1,New Plastics Economy Innovation Prize: $2 million toward creating a plastics system that works https://t.co/EEpIuBz4OL @newplasticsecon,2017-05-19 14:55:34,4,[],2971,,Twitter Web Client,None,None,None
782,865578957030215680,Life Without Plastic,LifeWoutPlastic,9,This refugee is building homes out of plastic bottles https://t.co/1mHRtPi89i via @HuffPostImpact,2017-05-19 14:44:39,20,[],2971,,Twitter Web Client,None,None,None
783,864877685247545346,Life Without Plastic,LifeWoutPlastic,6,"Henderson Island is the most remote, most polluted place on Earth: https://t.co/RaDsgX1EkO",2017-05-17 16:18:03,5,[],2971,,Twitter Web Client,None,None,None
784,864477606418231297,Life Without Plastic,LifeWoutPlastic,2,"Join us and @Postlandfill at #SZW17 in Philly, Nov 3&amp;4 - register now for a discount, submit a workshop by June 1st! https://t.co/Z09zVMBRcs https://t.co/fg1u7kZPrC",2017-05-16 13:48:17,4,"[{'text': 'SZW17', 'indices': [29, 35]}]",2971,,Twitter Web Client,None,None,None
785,863870907076550657,Life Without Plastic,LifeWoutPlastic,11,Plastic-free aisle in supermarkets urged to cut polluting food packaging https://t.co/KAQjDe5GX5,2017-05-14 21:37:28,8,[],2971,,Twitter Web Client,None,None,None
786,863050472160194564,Life Without Plastic,LifeWoutPlastic,0,Brutal Bermudian Beauty: Reliving the 2017 Devil’s Isle Challenge https://t.co/SaeopC35zq via @SUPthemag @plastictides,2017-05-12 15:17:21,1,[],2971,,Twitter Web Client,None,None,None
787,863016380119093249,Life Without Plastic,LifeWoutPlastic,5,12 amazing plastic-free toys for summer: https://t.co/zIoOB4mO4O,2017-05-12 13:01:53,3,[],2971,,Twitter Web Client,None,None,None
788,862666177855803392,Life Without Plastic,LifeWoutPlastic,4,Styrofoam - yuck. Take the pledge and learn how to contact your representative to demand change in legislation https://t.co/CVpiVDxVDr,2017-05-11 13:50:19,6,[],2971,,Twitter Web Client,None,None,None
789,862108123280138240,Life Without Plastic,LifeWoutPlastic,0,A very loyal customer sent us this picture of the live mousetrap she bought from our online… https://t.co/ezc6w2ps0o,2017-05-10 00:52:48,0,[],2971,,Instagram,None,None,None
790,862031093951848450,Life Without Plastic,LifeWoutPlastic,1,Unbreakable and Plastic-free for the Patio - Read our Newsletter -  https://t.co/2ZpwSBeJ7j,2017-05-09 19:46:43,0,[],2971,,Mailchimp,None,None,None
791,861968229803200514,Life Without Plastic,LifeWoutPlastic,5,There’s Probably Plastic in Your Sea Salt @hakaimagazine https://t.co/uecjXruAyo,2017-05-09 15:36:55,6,[],2971,,Twitter Web Client,None,None,None
792,861963131047866369,Life Without Plastic,LifeWoutPlastic,10,Swedish supermarket replaces produce stickers with laser branding: https://t.co/eLd9ivs5bv,2017-05-09 15:16:39,11,[],2971,,Twitter Web Client,None,None,None
793,861595356945145856,Life Without Plastic,LifeWoutPlastic,4,One month count down until World Oceans Day! How will you take action for the oceans? https://t.co/iKEURzyk0N https://t.co/A41blFeKnj,2017-05-08 14:55:15,6,[],2971,,Hootsuite,None,None,None
794,860947939941896193,Life Without Plastic,LifeWoutPlastic,6,Standing Up to the Plastic Bottled Water Industry in Europe https://t.co/4WbjlWK6qQ,2017-05-06 20:02:39,8,[],2971,,Twitter Web Client,None,None,None
795,860522752746418176,Life Without Plastic,LifeWoutPlastic,3,The Ocean Cleanup raises $21.7 million to begin ridding the Pacific Ocean of large plastic pieces https://t.co/Jyg9pY9QZK,2017-05-05 15:53:06,6,[],2971,,Twitter Web Client,None,None,None
796,860469498607960064,Life Without Plastic,LifeWoutPlastic,30,Take 2 seconds to tell @CocaCola how you feel about their plastic waste. Sign the @Greenpeace petition https://t.co/sBdoKWtSEZ https://t.co/8likglkJQD,2017-05-05 12:21:29,28,[],2971,,Twitter Web Client,None,None,None
797,859810045768470528,Life Without Plastic,LifeWoutPlastic,10,Skip the plastic wrap and reach for a Reusable Cotton Bowl Cover instead! https://t.co/4Uq8kj3qcb,2017-05-03 16:41:04,10,[],2971,,Twitter Web Client,None,None,None
798,859518379824205825,Life Without Plastic,LifeWoutPlastic,4,"RT @nugrocery: Nice break with local eco-entrepreneur Chantal from @LifeWoutPlastic, a pioneer of the #noplastic movement. Lots to learn fr…",2017-05-02 21:22:05,0,"[{'text': 'noplastic', 'indices': [102, 112]}]",2971,,Twitter Web Client,"Nice break with local eco-entrepreneur Chantal from @LifeWoutPlastic, a pioneer of the #noplastic movement. Lots to learn from her! #socent https://t.co/Lhhim6FADH",None,None
799,859518355975409665,Life Without Plastic,LifeWoutPlastic,2,@nugrocery Inspiring visit! Shout out for opening the 1st zerowaste grocery store in Ottawa! We just can't wait for it to open! #zerowaste #noplastic,2017-05-02 21:21:59,5,"[{'text': 'zerowaste', 'indices': [128, 138]}, {'text': 'noplastic', 'indices': [139, 149]}]",2971,,Twitter Web Client,None,None,None
800,859362849906450433,Life Without Plastic,LifeWoutPlastic,1,"#Repost: cleancoffeeproject
···
“ This time it could hit all of us. Say no to plastic. Credits:… https://t.co/0W7UvBAR2T",2017-05-02 11:04:04,2,"[{'text': 'Repost', 'indices': [0, 7]}]",2971,,Instagram,None,None,None
801,859130599684132864,Life Without Plastic,LifeWoutPlastic,1,"#Repost: @Trashis4Tossers 
···
The First Zero Waste lifestyle shop is now open! 137 Grand… https://t.co/ez7IwFCvZA",2017-05-01 19:41:11,3,"[{'text': 'Repost', 'indices': [0, 7]}]",2971,,Instagram,None,None,None
802,858057755365699588,Life Without Plastic,LifeWoutPlastic,13,Plastic-eating caterpillar could revolutionize waste treatment https://t.co/lQ7zAXzb6d,2017-04-28 20:38:05,15,[],2971,,Twitter Web Client,None,None,None
803,858056816302882816,Life Without Plastic,LifeWoutPlastic,8,"A Very Hungry Caterpillar Eats Plastic Bags, Researchers Say https://t.co/aYaLtQ0Vif",2017-04-28 20:34:21,10,[],2971,,Twitter Web Client,None,None,None
804,857647246191493121,Life Without Plastic,LifeWoutPlastic,0,Taking good care of your boots and shoes will make them last so much longer. How cool is this… https://t.co/xxG9LFumoY,2017-04-27 17:26:52,4,[],2971,,Instagram,None,None,None
805,856601410229739520,Life Without Plastic,LifeWoutPlastic,26,Vancouver Aquarium bans water bottles and other disposable plastics: https://t.co/EpsKG2Uz3A,2017-04-24 20:11:05,44,[],2971,,Twitter Web Client,None,None,None
806,855925034443059200,Life Without Plastic,LifeWoutPlastic,3,These four high impact items are 10% off for Earth Day... On sale for the next two… https://t.co/O6yHYH68jU,2017-04-22 23:23:25,2,[],2971,,Instagram,None,None,None
807,855482342445654018,Life Without Plastic,LifeWoutPlastic,2,Celebrate Earth Day with 4 High Impact Items -  https://t.co/2J8tHXeDLq,2017-04-21 18:04:19,3,[],2971,,Mailchimp,None,None,None
808,855421899119226880,Life Without Plastic,LifeWoutPlastic,10,6 cosmetics companies with refillable packaging: https://t.co/QNkyVCnhen,2017-04-21 14:04:08,16,[],2971,,Twitter Web Client,None,None,None
809,855062503843409920,Life Without Plastic,LifeWoutPlastic,0,"#Repost: ofbranchandbone
···
“ I don't often feel the need to use a lint brush but occasionally… https://t.co/kIsL14Fa73",2017-04-20 14:16:01,0,"[{'text': 'Repost', 'indices': [0, 7]}]",2971,,Instagram,None,None,None
810,854692643116396544,Life Without Plastic,LifeWoutPlastic,0,BALM! Baby's annual Earth Month Challenge + Giveaway is ON! 💚🌍💚 ENTER &amp; SIGN UP HERE ▶️ https://t.co/IwaDeRVRJy https://t.co/67Kb76ftKo,2017-04-19 13:46:20,0,[],2971,,Twitter Web Client,None,None,None
811,854426079976673283,Life Without Plastic,LifeWoutPlastic,1,Having a waste-free lunch with Bea Johnson (@zerowastehome) and Valerie Leloup (nugrocery).… https://t.co/DvJU9HnyTY,2017-04-18 20:07:06,6,[],2971,,Instagram,None,None,None
812,854154063562379264,Life Without Plastic,LifeWoutPlastic,6,Want Some Salt With Your Plastic? — Study: 17 of 17 Sea Salt Brands Littered With Petrochemicals - https://t.co/gUa0LPAt9O @EnviroNewsTV,2017-04-18 02:06:12,5,[],2971,,Twitter Web Client,None,None,None
813,854135757732237313,Life Without Plastic,LifeWoutPlastic,22,This 'edible water bottle' could put an end to plastic packaging https://t.co/0BXvnsBXXj via @telegraphtech,2017-04-18 00:53:28,20,[],2971,,Twitter Web Client,None,None,None
814,854127889159270400,Life Without Plastic,LifeWoutPlastic,12,Are you a plastic addict? Viral video campaign calls for plastic free aisles in supermarkets  https://t.co/UIeCx05x6W via @TelegraphSci,2017-04-18 00:22:12,11,[],2971,,Twitter Web Client,None,None,None
815,854015895164923905,Life Without Plastic,LifeWoutPlastic,0,The day after... GOTS certified organic cotton mesh bag that can hold more than just fresh… https://t.co/MMzRW8RPu8,2017-04-17 16:57:10,1,[],2971,,Instagram,None,None,None
816,853257909127577601,Life Without Plastic,LifeWoutPlastic,6,Nurse turns plastic waste into artwork for the hospital. https://t.co/35uEMpaaWy,2017-04-15 14:45:12,8,[],2971,,Hootsuite,None,None,None
817,852978593604960256,Life Without Plastic,LifeWoutPlastic,4,Cheers it's the end of the week! Fancy up your Friday nights with these elegant stainless steel wine glasses! https://t.co/ns9ksSScDt https://t.co/hRY0pCiTng,2017-04-14 20:15:18,4,[],2971,,Hootsuite,None,None,None
818,852852129916170241,Life Without Plastic,LifeWoutPlastic,19,RT @volunteerat_LEO: @rethinkthebag @PlasticPollutes @LifeWoutPlastic #noplastic #recycle #savetheoceans #loveanimals #leoafrica @RTAwardsA…,2017-04-14 11:52:47,0,"[{'text': 'noplastic', 'indices': [70, 80]}, {'text': 'recycle', 'indices': [81, 89]}, {'text': 'savetheoceans', 'indices': [90, 104]}, {'text': 'loveanimals', 'indices': [105, 117]}, {'text': 'leoafrica', 'indices': [118, 128]}]",2971,,Twitter Web Client,@rethinkthebag @PlasticPollutes @LifeWoutPlastic #noplastic #recycle #savetheoceans #loveanimals #leoafrica @RTAwardsAfrica #savetheplanet https://t.co/1puNMaMZJ0,None,None
819,852532244325576704,Life Without Plastic,LifeWoutPlastic,6,NYC will get its first zero-waste store this spring! https://t.co/Z23RfCp66S,2017-04-13 14:41:40,13,[],2971,,Twitter Web Client,None,None,None
820,852252197685538816,Life Without Plastic,LifeWoutPlastic,4,"The sun is shining, that's a good enough reason for a sale!   20% OFF selected items while quantities remain! https://t.co/85XkRaeRna https://t.co/BJuOtWIEqK",2017-04-12 20:08:52,1,[],2971,,Twitter Web Client,None,None,None
821,851576048777080832,Life Without Plastic,LifeWoutPlastic,1,"Can't wait for packagefreeshop to open... So proud to be part of it!!

@Trashis4Tossers… https://t.co/Irl0OZyK2E",2017-04-10 23:22:06,10,[],2971,,Instagram,None,None,None
822,850776543710384128,Life Without Plastic,LifeWoutPlastic,5,"Earth Day is April 22 and Ecology Ottawa is ready! Register for their park summit and celebration! @EcologyOttawa 
https://t.co/Rvn9yEz33L https://t.co/7G2Blu5Krn",2017-04-08 18:25:09,6,[],2971,,Hootsuite,None,None,None
823,850374936967487488,Life Without Plastic,LifeWoutPlastic,1,Get these items from our spring cleaning before they are discontinued -  https://t.co/GJ3tqfT5cO,2017-04-07 15:49:18,0,[],2971,,Mailchimp,None,None,None
824,850000658493304832,Life Without Plastic,LifeWoutPlastic,9,Sullie Seagull is taking on plastic pollution. Laugh and learn with this inspiring children's coloring book! https://t.co/YZYkbDk6t0 https://t.co/1QuAvjLivr,2017-04-06 15:02:03,10,[],2971,,Twitter Web Client,None,None,None
825,849476649351622656,Life Without Plastic,LifeWoutPlastic,4,Stop plastic microfiber pollution with this ingenious laundry bag: https://t.co/rY6Ynlav4k via @treehugger,2017-04-05 04:19:50,5,[],2971,,Twitter Web Client,None,None,None
826,849297746301517826,Life Without Plastic,LifeWoutPlastic,3,Our handy and beloved sporks are back in stock! https://t.co/blRvwS2NPP,2017-04-04 16:28:56,7,[],2971,,Twitter Web Client,None,None,None
827,849032035356344320,Life Without Plastic,LifeWoutPlastic,1,"Our spork in an organic cotton bag is back in stock!

Check out the video Gittemary did about… https://t.co/OysofmaZcX",2017-04-03 22:53:06,3,[],2971,,Instagram,None,None,None
828,848551896252076032,Life Without Plastic,LifeWoutPlastic,6,Turn your mason jar into a plastic free soap dispenser with this screw on lid! a must have for zero waste shopping.  https://t.co/W1Xq8Z181J https://t.co/WoxzDZ9qoL,2017-04-02 15:05:12,25,[],2971,,Hootsuite,None,None,None
829,847821687517315072,Life Without Plastic,LifeWoutPlastic,4,Here is what you need to build a zero waste emergency food kit: https://t.co/RQyw6Vf5KI,2017-03-31 14:43:36,7,[],2971,,Twitter Web Client,None,None,None
830,846818987174494208,Life Without Plastic,LifeWoutPlastic,2,What's a No-Excuse Straw Kit ? Come see...  https://t.co/WRhGQH7NDd,2017-03-28 20:19:14,7,[],2971,,Twitter Web Client,None,None,None
831,846166109351018496,Life Without Plastic,LifeWoutPlastic,19,International Plastic Kills Campaign Launches in Spain https://t.co/df0ZZN47UV @plasticpollutes @naturaselection,2017-03-27 01:04:56,29,[],2971,,Twitter Web Client,None,None,None
832,846165271324884993,Life Without Plastic,LifeWoutPlastic,9,'Wasteland' puts single-use plastic on the map • Surfers Against Sewage https://t.co/NrKKDB71Hh via @sascampaigns,2017-03-27 01:01:36,10,[],2971,,Twitter Web Client,None,None,None
833,846133669915971584,Life Without Plastic,LifeWoutPlastic,6,Our Plastics Glut Is An Environmental Nightmare  --  And An $80 Billion Opportunity via @forbes https://t.co/TTzZdU97m5,2017-03-26 22:56:01,11,[],2971,,Twitter Web Client,None,None,None
834,846052911423590400,Life Without Plastic,LifeWoutPlastic,21,Austria supermarkets voluntarily stop using plastic bags! Way to go Austria! https://t.co/8eGfH6KRpi,2017-03-26 17:35:07,36,[],2971,,Hootsuite,None,None,None
835,845714454872555520,Life Without Plastic,LifeWoutPlastic,9,"Welcome to Wasteland, the newest and most threatening country made up entirely of waste https://t.co/hXe8vwRtSj https://t.co/1CNWsVEJ3V",2017-03-25 19:10:13,3,[],2971,,Hootsuite,None,None,None
836,845654069628801024,Life Without Plastic,LifeWoutPlastic,3,Kollam City police and students unite for the world against plastic waste https://t.co/5bjxRfm7ik,2017-03-25 15:10:16,7,[],2971,,Hootsuite,None,None,None
837,845411092536922113,Life Without Plastic,LifeWoutPlastic,3,Tunisia bans disposable plastic shopping bags: https://t.co/lLPMm2ueTv,2017-03-24 23:04:46,20,[],2971,,Twitter Web Client,None,None,None
838,845410941684649985,Life Without Plastic,LifeWoutPlastic,3,"Michigan bans bans on plastic bags, takeout food containers, styrofoam cups and just about anything else: https://t.co/yzsDG76YDt",2017-03-24 23:04:10,5,[],2971,,Twitter Web Client,None,None,None
839,845259437057228801,Life Without Plastic,LifeWoutPlastic,3,Artist Group in Sweden Ships Truckload of Plastic to raise eyebrows https://t.co/AYVec98zmg via @onegreenplanet,2017-03-24 13:02:08,2,[],2971,,Twitter Web Client,None,None,None
840,844999140295806977,Life Without Plastic,LifeWoutPlastic,4,The No-Excuse Straw Kit. Read on for a 50% coupon! -  https://t.co/WRhGQH7NDd,2017-03-23 19:47:49,5,[],2971,,Mailchimp,None,None,None
841,844584647065427968,Life Without Plastic,LifeWoutPlastic,18,"RT @nugrocery: Only 20% of plastic water bottles are properly recycled. On #WorldWaterDay, #DitchThePlastic once and for all! https://t.co/…",2017-03-22 16:20:46,0,"[{'text': 'WorldWaterDay', 'indices': [75, 89]}, {'text': 'DitchThePlastic', 'indices': [91, 107]}]",2971,,Twitter Web Client,"Only 20% of plastic water bottles are properly recycled. On #WorldWaterDay, #DitchThePlastic once and for all! https://t.co/XomhQfx4ge",None,None
842,844548452453421056,Life Without Plastic,LifeWoutPlastic,414,RT @Greenpeace: Every single piece of #plastic ever made still exists. Here’s the story. https://t.co/RNgmbz4mbf https://t.co/dDZga0XUbb,2017-03-22 13:56:56,0,"[{'text': 'plastic', 'indices': [38, 46]}]",2971,,Twitter Web Client,Every single piece of #plastic ever made still exists. Here’s the story. https://t.co/RNgmbz4mbf https://t.co/dDZga0XUbb,None,None
843,843126148393582598,Life Without Plastic,LifeWoutPlastic,5,Bacteria that eats plastic. Helpful or harmful? What do you think? https://t.co/kK1atKvt8h,2017-03-18 15:45:12,4,[],2971,,Hootsuite,None,None,None
