,tweet_id,name,screen_name,retweet_count,text,created_at,favourite_count,hashtags,status_count,location,source_device,retweet_text,quote_text,quote_screen_name
0,1279434264518549505,Life Without Plastic,LifeWoutPlastic,4,Europe’s Plastic Recycling is Getting Dumped in the Ocean https://t.co/knAccsRGwi via @string,2020-07-04 15:17:54,5,[],2971,,Twitter for iPhone,None,None,None
1,1279061643683491842,Life Without Plastic,LifeWoutPlastic,1,"To kick off #PlasticFreeJuly, we are happy to announce that our #MonthlySale is on our LWP book! This book is the ultimate guide to living a #LifeWithoutPlastic. Get it for 10% off this month here here: https://t.co/MZ4ZEfEmEL",2020-07-03 14:37:14,3,"[{'text': 'PlasticFreeJuly', 'indices': [12, 28]}, {'text': 'MonthlySale', 'indices': [64, 76]}, {'text': 'LifeWithoutPlastic', 'indices': [141, 160]}]",2971,,Planable,None,None,None
2,1278339921854554112,Life Without Plastic,LifeWoutPlastic,0,Study Finds Microplastics Inside Fruits and Vegetables https://t.co/6bc8t5Vz88 via @string,2020-07-01 14:49:22,0,[],2971,,Twitter for iPhone,None,None,None
3,1278333811168817153,Life Without Plastic,LifeWoutPlastic,9,"Join the movement! #PlasticFreeJuly is a time for us to reflect on our use of plastic and the impact it is having on our health and environment. Take the challenge and reduce your use! Pick a friend to join you, and together make a real difference this year. #LifeWithoutPlastic https://t.co/r1cVAve4Bl",2020-07-01 14:25:05,16,"[{'text': 'PlasticFreeJuly', 'indices': [19, 35]}, {'text': 'LifeWithoutPlastic', 'indices': [259, 278]}]",2971,,Planable,None,None,None
4,1277975469355200516,Life Without Plastic,LifeWoutPlastic,0,Today is the LAST day to subscribe to the Life Without Plastic Subscription Box in time to receive the Summer *2020* Box! This box is meant to help you enjoy the great outdoors this season and avoid harming the environment.  🌞📦💫Subscribe here: https://t.co/HJNermf5ld,2020-06-30 14:41:10,0,[],2971,,Planable,None,None,None
5,1277607390964322305,Life Without Plastic,LifeWoutPlastic,0,2/2 HINT! Visit https://t.co/cPvhCKuPbM to discover the answer and input your guess on the google form here: https://t.co/D20gYVAMRA,2020-06-29 14:18:33,0,[],2971,,Planable,None,None,None
6,1277607332369829896,Life Without Plastic,LifeWoutPlastic,0,"1/2: CONTEST ALERT! Win a $50 gift card to Elements Truffles. To enter, Follow us AND @elementstruffle on Twitter, use the google form to respond to this question: ""What lifestyle system from India is the inspiration for Elements Truffles line of clean chocolate?"" https://t.co/CaaFEGpqoD",2020-06-29 14:18:19,0,[],2971,,Planable,None,None,None
7,1277596332593684481,Life Without Plastic,LifeWoutPlastic,1,"Scientists pin blame for some coronavirus deaths on air pollution, PFAS, and other chemicals https://t.co/kwU8JeHm2n by @fastlerner",2020-06-29 13:34:36,1,[],2971,,Twitter for iPhone,None,None,None
8,1277595749493211136,Life Without Plastic,LifeWoutPlastic,2,Coronavirus: Plastic waste surges as restaurants use more disposable packaging https://t.co/QOyjG0LfGY,2020-06-29 13:32:17,1,[],2971,,Twitter for iPhone,None,None,None
9,1277595630014210049,Life Without Plastic,LifeWoutPlastic,0,Coronavirus and the return of plastic – in pictures https://t.co/F6HyhKyLIT,2020-06-29 13:31:49,0,[],2971,,Twitter for iPhone,None,None,None
10,1276518930258018304,Life Without Plastic,LifeWoutPlastic,2,The Plastic Pandemic https://t.co/XZMFtLM1Pu,2020-06-26 14:13:24,0,[],2971,,Twitter for iPhone,None,None,None
11,1276211520293220353,Life Without Plastic,LifeWoutPlastic,0,"New to the #zerowaste movement? Ready to take on Plastic-Free July, but need a bit of boost to get you there? Check out our seasonal Subscription Box...the Summer box is available to order by June 30th! https://t.co/EfSksvpXqM https://t.co/ePaIjuCWhj",2020-06-25 17:51:51,5,"[{'text': 'zerowaste', 'indices': [11, 21]}]",2971,,Planable,None,None,None
12,1275524418534625283,Life Without Plastic,LifeWoutPlastic,4,"Stainless steel essentials = reusable straws &amp; sporks + a stack of our reusable containers! We love stainless steel because it’s durable, long-lasting, and easy to clean!✨ https://t.co/WHT6QJl4f0",2020-06-23 20:21:34,12,[],2971,,Planable,None,None,None
13,1273291037059006473,Life Without Plastic,LifeWoutPlastic,0,Monthly Sale! Our stainless steel Freezycup™ is on sale until the end of June. Save 15% off and get creative with flavours as you use them over and over again without producing waste or ingesting chemicals that leach out of plastics. Shop the sale HERE: https://t.co/vHPGkLu1Vw,2020-06-17 16:26:54,0,[],2971,,Planable,None,None,None
14,1272887004565581825,Life Without Plastic,LifeWoutPlastic,0,Plastic-free Refreshment During a Summer of Change - https://t.co/GZynq4t9sO https://t.co/jZvNnghlA9,2020-06-16 13:41:25,3,[],2971,,Mailchimp,None,None,None
15,1272529584437805058,Life Without Plastic,LifeWoutPlastic,2,"The Healthy Pregnancy Guide by @plasticpollutes &amp; @madesafehq has arrived! This is a great resource for expecting parents looking to create a safe, toxic-free environment for their growing family. Download your free copy today! https://t.co/RuwhHG6pdC https://t.co/srlCVyLyEE",2020-06-15 14:01:10,5,[],2971,,Planable,None,None,None
16,1271547722466824205,Life Without Plastic,LifeWoutPlastic,0,Plastic-free Refreshment During a Summer of Change - https://t.co/iPCxbCcaif https://t.co/e40wyxWVhb,2020-06-12 20:59:35,1,[],2971,,Mailchimp,None,None,None
17,1271432949867700224,Life Without Plastic,LifeWoutPlastic,2,"Great, now the ocean is filled with COVID trash: Masks, gloves, and hand sanitizer https://t.co/6RQhxvSvXj via @grist",2020-06-12 13:23:31,3,[],2971,,Twitter for iPhone,None,None,None
18,1270359737813647360,Life Without Plastic,LifeWoutPlastic,1,"Plastic and Climate Change Collide: Youth Movement Responds &lt;3
Join us TODAY, TUESDAY June 9 | 11:00a PT / 2:00p ET / 6:00p GMT
Register HERE: https://t.co/Y3Zd0TjyI7
Be part of the solution to the plastic pollution climate crisis: learn what you can do NOW to make change! https://t.co/pHVUYokJBg",2020-06-09 14:18:58,4,[],2971,,Planable,None,None,None
19,1270017309822853121,Life Without Plastic,LifeWoutPlastic,0,"Join the United Nations virtual summit in celebration of the 2020 theme, Innovation for a Sustainable Ocean. The Official United Nations World Oceans Day 2020 Virtual Event is taking place this Monday, June 8th, 2020 | 10 AM - 5 PM EDT. https://t.co/dTdosR8pGE https://t.co/8OxjboTozx",2020-06-08 15:38:17,0,[],2971,,Planable,None,None,None
20,1270017282824196097,Life Without Plastic,LifeWoutPlastic,3,"This June 8th, 2020 is #WorldOceansDay 🌊. Join the call for 30x30 by signing the petition that will help get government leaders worldwide to agree to protect at least 30% of the planet’s land and ocean by 2030! Petition here: https://t.co/GyuXcm6Aec https://t.co/dpUxJQl0h7",2020-06-08 15:38:10,15,"[{'text': 'WorldOceansDay', 'indices': [23, 38]}]",2971,,Planable,None,None,None
21,1268286735395454978,Life Without Plastic,LifeWoutPlastic,1,"Not only should we stand up &amp; speak out, but also listen &amp; learn. To support &amp; amplify voices needing to be heard right now we are not posting our own content from now until June 7. Artwork: @BrandyChieco #enoughisenough #georgefloyd #blacklivesmatter #Equality #Justiceforall https://t.co/eZtrup57vP",2020-06-03 21:01:36,7,"[{'text': 'enoughisenough', 'indices': [217, 232]}, {'text': 'georgefloyd', 'indices': [233, 245]}, {'text': 'blacklivesmatter', 'indices': [246, 263]}, {'text': 'Equality', 'indices': [264, 273]}, {'text': 'Justiceforall', 'indices': [274, 288]}]",2971,,Planable,None,None,None
22,1266443348803543040,Life Without Plastic,LifeWoutPlastic,1,Fix drinking water supplies to reduce ocean plastic https://t.co/dNj5XXMdlV,2020-05-29 18:56:38,4,[],2971,,Twitter for iPhone,None,None,None
23,1266441934702350338,Life Without Plastic,LifeWoutPlastic,2,River birds ingest up to 200 microplastic pieces daily https://t.co/uHFZGK6xOo,2020-05-29 18:51:01,1,[],2971,,Twitter for iPhone,None,None,None
24,1265367790845857794,Life Without Plastic,LifeWoutPlastic,1,"Introducing Life Without Plastic's new Solid Dish Soap Bar. Create a bundle by adding our Wooden Dish Brush and get 15% off the dish brush! Washing dishes without plastic packaging and synthetic chemicals has never been easier. 
Shop here: https://t.co/DbfamBWFKM https://t.co/Udmus3HRfW",2020-05-26 19:42:45,5,[],2971,,Planable,None,None,None
25,1265364437793464320,Life Without Plastic,LifeWoutPlastic,2,Washing dishes naturally without plastic - https://t.co/Eo8OCq7xiC https://t.co/FDT9wbMKmP,2020-05-26 19:29:25,7,[],2971,,Mailchimp,None,None,None
26,1263854384468934665,Life Without Plastic,LifeWoutPlastic,1,"Registration for the @creativemorning talk with our co-founder Jay Sinha is now open! Jay will speak about the sacred powers of nature and how to access them in our lives. The virtual event is free, but you must register in advance here: https://t.co/RbjeAmkOQj https://t.co/ZguD7Dh5Eo",2020-05-22 15:29:01,1,[],2971,,Planable,None,None,None
27,1261296306884153345,Life Without Plastic,LifeWoutPlastic,1,Sea spray is full of microplastics https://t.co/BrOCtXz9HQ,2020-05-15 14:04:07,7,[],2971,,Twitter for iPhone,None,None,None
28,1260949777681965056,Life Without Plastic,LifeWoutPlastic,5,"Less than 10% of plastics that go into the recycling bin actually get recycled. Learn about the chasing arrow 1-7 recycling codes, the toxicity of plastics, and how to avoid plastics altogether using alternatives you already have or can source from us: https://t.co/5kfUU14OFx https://t.co/vcnn6VydOa",2020-05-14 15:07:08,7,[],2971,,Planable,None,None,None
29,1260631405408722944,Life Without Plastic,LifeWoutPlastic,0,Head over to our Facebook page and learn 5 ways to help reduce plastic at home! Link here: https://t.co/jOBWO3V7dT https://t.co/S6lT64RBD3,2020-05-13 18:02:03,7,[],2971,,Planable,None,None,None
30,1260200350126166016,Life Without Plastic,LifeWoutPlastic,3,"It’s never time to stop celebrating our Mothers! The much-anticipated Healthy Pregnancy Guide by @plasticpollutes &amp; @madesafehq launches 5/27. It's a great tool for expecting parents looking to create a safe, toxic-free environment for their growing family https://t.co/aW708qgwex https://t.co/LrqTOFTw0L",2020-05-12 13:29:11,6,[],2971,,Planable,None,None,None
31,1259904261133082626,Life Without Plastic,LifeWoutPlastic,3,"VERY IMPORTANT FILM: ""The Story of Plastic"" is a moving film that reveals where plastic comes from – and where it goes https://t.co/d2KI6345H5",2020-05-11 17:52:38,6,[],2971,,Twitter for iPhone,None,None,None
32,1259516248049831938,Life Without Plastic,LifeWoutPlastic,1,"Although words will never be enough, we want to thank all the Moms out there for working extra hard to keep their families safe during these times. We see you, we love you, and we thank you. 💚 🧡 💚 https://t.co/FMZ5WSROMM",2020-05-10 16:10:48,7,[],2971,,Planable,None,None,None
33,1258568582121783302,Life Without Plastic,LifeWoutPlastic,9,"The plastics industry is booming right now, thanks to the coronavirus https://t.co/CJba4H0lBE",2020-05-08 01:25:07,6,[],2971,,Twitter for iPhone,None,None,None
34,1258137454789476353,Life Without Plastic,LifeWoutPlastic,0,"Our #monthlysale is on our largest round stainless steel food storage containers (26 cm / 10 1/4""). It is airtight, watertight, and superb for storing large batches of food or bulk foods!

Until the end of May, enjoy 20% off this item! Shop sale: https://t.co/ARk3UvQ2Ze",2020-05-06 20:51:58,1,"[{'text': 'monthlysale', 'indices': [4, 16]}]",2971,,Planable,None,None,None
35,1257413155023728643,Life Without Plastic,LifeWoutPlastic,2,"What Moms really need is a hand, or two... - https://t.co/XipYKAr1IO https://t.co/Z7qeVv9GfU",2020-05-04 20:53:52,4,[],2971,,Mailchimp,None,None,None
36,1254772102328008704,Life Without Plastic,LifeWoutPlastic,3,Got a sewing machine and know how to use it? Join our Community Face Mask Project! You can use materials you have at home like a cotton T-shirt or cotton bedsheets. Learn our pattern and earn money by making masks to help flatten the curve. Details at https://t.co/twOofvO5So https://t.co/fc35JUyn9X,2020-04-27 13:59:16,8,[],2971,,Planable,None,None,None
37,1253722900957483008,Life Without Plastic,LifeWoutPlastic,4,"Did you know that all our packaging is completely plastic-free? Right down to the tag. And when you order from us, we ensure that all your plastic-free products arrive without plastic packing materials as well---💛! https://t.co/tgldN9GUbX",2020-04-24 16:30:07,11,[],2971,,Planable,None,None,None
38,1252957430176198657,Life Without Plastic,LifeWoutPlastic,5,Did you know it takes 22 gal / 83 L of water to produce one lb / half a kg of plastic? That means it takes more water to make a plastic water bottle than the amount of water the bottle can hold. Calculate your hidden water footprint with this fun quiz: https://t.co/WkLYYUrBwa,2020-04-22 13:48:24,4,[],2971,,Planable,None,None,None
39,1252957367446261762,Life Without Plastic,LifeWoutPlastic,2,5. Laundry bar - eliminate plastic detergent bottles from your laundry room with our simple laundry bar! Dilute in water and use it for up to 125 loads: https://t.co/GGc78howmA,2020-04-22 13:48:09,5,[],2971,,Planable,None,None,None
40,1252948577455951872,Life Without Plastic,LifeWoutPlastic,1,3. Razor - switch out disposable razors for a safety razor made from steel. This type of razor will last indefinitely and ultimately save you money over time. Shop our quality-affordable selection here: https://t.co/yuqXj8ibN9,2020-04-22 13:13:14,3,[],2971,,Planable,None,None,None
41,1252948577430786049,Life Without Plastic,LifeWoutPlastic,1,"4. Shampoo / Conditioner - depending on your hair type, there are plenty of DIY washes that will work, but another easy alternative is to purchase a solid shampoo bar. Find a selection of soap and shampoo bars on our website, like this one: https://t.co/js0kXinqPy",2020-04-22 13:13:14,3,[],2971,,Planable,None,None,None
42,1252948199901446145,Life Without Plastic,LifeWoutPlastic,0,"2. Toothpaste / Mouthwash - make your own using simple ingredients like baking soda, coconut oil, and peppermint oil OR try using our tooth tabs as another plastic-free alternative: https://t.co/pRUm1PH5DD",2020-04-22 13:11:44,2,[],2971,,Planable,None,None,None
43,1252947822468530177,Life Without Plastic,LifeWoutPlastic,1,"1. Water Bottle - instead of buying cases of plastic water bottles, find a reusable bottle or even glass jar that you can refill at home or on the go! If your tap water needs filtering, try our neat charcoal filter: https://t.co/J0P9AH08Bn",2020-04-22 13:10:14,3,[],2971,,Planable,None,None,None
44,1252947428086550528,Life Without Plastic,LifeWoutPlastic,3,"The theme for Earth Day 2020 is #ClimateAction! 🌍To celebrate the 50th anniversary of #EarthDay, take action at home by making one small change in your routine where plastic persists. See our next tweets for 5 common plastics that are easy to eliminate from your home...",2020-04-22 13:08:40,6,"[{'text': 'ClimateAction', 'indices': [32, 46]}, {'text': 'EarthDay', 'indices': [86, 95]}]",2971,,Planable,None,None,None
45,1252283590420946945,Life Without Plastic,LifeWoutPlastic,0,"As our entire team works hard on our community face mask project, we encourage you to pre-order masks through our website. Thanks so much to @amsoniamade for the photos and to all the sewists who are working hard!

Pre-order here:
https://t.co/u5RRQsX3Et https://t.co/mQVWC78gzh",2020-04-20 17:10:48,1,[],2971,,Planable,None,None,None
46,1250546983535808512,Life Without Plastic,LifeWoutPlastic,0,Thinking outside the ice cube tray - Read our latest newsletter https://t.co/Re9nUJtdb5 https://t.co/LGnaWDZRUn,2020-04-15 22:10:09,0,[],2971,,Mailchimp,None,None,None
47,1249697192832532482,Life Without Plastic,LifeWoutPlastic,1,"Everything you need to know about face masks https://t.co/31WSM7LbWd If you’re looking to buy one, see the locally-made ones on our website.",2020-04-13 13:53:23,3,[],2971,,Twitter for iPhone,None,None,None
48,1249097664886640640,Life Without Plastic,LifeWoutPlastic,2,"In our upcoming newsletter, we demonstrate a number of freezer hacks using our Stainless Steel Ice Cube Tray, which is 15% off this month! Prepare to get creative and follow our hacks that can save you food (and money) as you self-isolate. https://t.co/KfJwTL78l9",2020-04-11 22:11:05,4,[],2971,,Planable,None,None,None
49,1247664368327757830,Life Without Plastic,LifeWoutPlastic,5,Support our face mask community effort and buy a cotton mask!  https://t.co/pGP59xPvYP https://t.co/s0hSoupVCO,2020-04-07 23:15:40,4,[],2971,,Planable,None,None,None
50,1246478166488735745,Life Without Plastic,LifeWoutPlastic,0,"Now that the CDC is officially recommending wearing face masks in public, we need your help to produce more masks!⁣
⁣
The natural textile fabric masks we've been offering for the past 3 weeks disappear in less than… https://t.co/ERN4SppWMA",2020-04-04 16:42:07,2,[],2971,,Instagram,None,None,None
51,1246053906993631235,Life Without Plastic,LifeWoutPlastic,3,We are about to get buried in garbage https://t.co/G6RtLwQfPJ,2020-04-03 12:36:16,3,[],2971,,Twitter for iPhone,None,None,None
52,1243979446174068736,Life Without Plastic,LifeWoutPlastic,3,"How big Plastic is using shaky industry funded “research” to slam reusable bags. All bags, plastic included, may harbour virus droplets. The key, as it has always been, is washing. https://t.co/tqr5ac1sEI",2020-03-28 19:13:06,12,[],2971,,Twitter for iPhone,None,None,None
53,1243548349170663427,Life Without Plastic,LifeWoutPlastic,2,"SO IMPORTANT... Don't let this pandemic ruin the fight against single-use plastics https://t.co/AYK6j8v1LP Upshot: follow the science, disinfect, careful of misinfo",2020-03-27 14:40:05,3,[],2971,,Twitter for iPhone,None,None,None
54,1243244715379699718,Life Without Plastic,LifeWoutPlastic,0,Staying Safe with Less Plastics - Read our newsletter and discover our spring sale https://t.co/1MQ9rnyp3m https://t.co/UVKmG2HqOk,2020-03-26 18:33:33,0,[],2971,,Mailchimp,None,None,None
55,1241033627456212992,Life Without Plastic,LifeWoutPlastic,2,Vinyl: the - toxic - plastic found in (almost) everything https://t.co/ESeZdC1QF5,2020-03-20 16:07:28,0,[],2971,,Twitter for iPhone,None,None,None
56,1240701461245263872,Life Without Plastic,LifeWoutPlastic,0,Check out our newsletter about the launch of our website in Europe.  https://t.co/TY3wEJ654d,2020-03-19 18:07:34,1,[],2971,,Planable,None,None,None
57,1240344903638548485,Life Without Plastic,LifeWoutPlastic,1,Help! Coronavirus prevention is aggravating my single-use shame https://t.co/8OhOCaPmcX via @grist,2020-03-18 18:30:44,6,[],2971,,Twitter for iPhone,None,None,None
58,1239612109442494467,Life Without Plastic,LifeWoutPlastic,3,"We skip plastic baggies and plastic wrap by opting for durable and reusable alternatives like this long lasting Stainless Steel Snack container! Small enough for snack and has a divider to keep things separated #noplastic #zerowaste #plasticfree

https://t.co/0QwPwQ1eAT https://t.co/WKPvCyIt5D",2020-03-16 17:58:52,6,"[{'text': 'noplastic', 'indices': [211, 221]}, {'text': 'zerowaste', 'indices': [222, 232]}, {'text': 'plasticfree', 'indices': [233, 245]}]",2971,,Planable,None,None,None
59,1238118064840937472,Life Without Plastic,LifeWoutPlastic,7,20 foods you can make from scratch to avoid plastic https://t.co/iPIu4atKMc,2020-03-12 15:02:04,5,[],2971,,Twitter for iPhone,None,None,None
60,1238117372965408768,Life Without Plastic,LifeWoutPlastic,1,How to grocery shop when you can't bring your own containers https://t.co/2YjuXKdaiK,2020-03-12 14:59:19,2,[],2971,,Twitter for iPhone,None,None,None
61,1237383752885641217,Life Without Plastic,LifeWoutPlastic,3,"It's time to take action! Each year, Coca-Cola produces over 3 million TONS of plastic. Sign the @PlasticPollutes petition telling Coca-Cola that consumers do NOT want single-use plastic bottles polluting our planet. 

https://t.co/zA1BrcluUu",2020-03-10 14:24:10,9,[],2971,,Planable,None,None,None
62,1236653134027665408,Life Without Plastic,LifeWoutPlastic,1,"Today we celebrate all the incredible women of the world! You inspire us, and we support you. Keep using your voices, keep marching, and keep lifting each other up! Together we are changing the world.💪🏼💫 https://t.co/XYGjWLylOB",2020-03-08 14:00:57,9,[],2971,,Planable,None,None,None
63,1235974700926459904,Life Without Plastic,LifeWoutPlastic,0,"Our monthly sale features one of our most practical, popular, and portable airtight stainless steel containers. We recently restocked this item and knowing it's a favorite, we've put it on sale for a bit. Note: it's highly lunchbag &amp; backpack-friendly.
https://t.co/cGZ5y8jZxC",2020-03-06 17:05:06,0,[],2971,,Planable,None,None,None
64,1235294808706633728,Life Without Plastic,LifeWoutPlastic,0,"Time to kickstart your plastic-free journey with our Spring Subscription Box! 
Find out what you will receive in the box at:   
https://t.co/WLx5Tkzedk
The last day to order is March 31st.",2020-03-04 20:03:27,2,[],2971,,Planable,None,None,None
65,1234538103878144000,Life Without Plastic,LifeWoutPlastic,7,"Most plastics in our recycling bins aren't getting recycled, new report finds https://t.co/V3JZrGVCOb",2020-03-02 17:56:35,9,[],2971,,Twitter for iPhone,None,None,None
66,1233459584972599296,Life Without Plastic,LifeWoutPlastic,0,"How I gave up plastic bottles for shampoo, dish soap, and rinse aid  https://t.co/2n2QVtjbik",2020-02-28 18:30:56,6,[],2971,,Twitter for iPhone,None,None,None
67,1233158513129553920,Life Without Plastic,LifeWoutPlastic,1,Grocery stores may soon offer your favorite brands in reusable containers https://t.co/J7QiH2UznQ,2020-02-27 22:34:35,13,[],2971,,Twitter for iPhone,None,None,None
68,1232307390353203200,Life Without Plastic,LifeWoutPlastic,1,"Our European Online Store is now open! Find a selection of our best-sellers.
Check it out at https://t.co/09ekb6b4XS !! https://t.co/x4mxCg7A9Z",2020-02-25 14:12:31,0,[],2971,,Planable,None,None,None
69,1232306920054112257,Life Without Plastic,LifeWoutPlastic,0,"Groundbreaking U.S. legislation to tackle plastic pollution crisis: support the ""Break Free From Plastic Pollution Act 2020"". 
Learn more at: https://t.co/iovy62y023",2020-02-25 14:10:39,2,[],2971,,Planable,None,None,None
70,1230940314065625095,Life Without Plastic,LifeWoutPlastic,0,"Don’t miss out on this month’s sale! Our reusable straw kit includes a food-grade stainless steel straw, its own cleaning brush, a certified organic cotton pouch for carrying... and it’s on SALE now! 
https://t.co/fI8fAPd2Ri",2020-02-21 19:40:15,1,[],2971,,Planable,None,None,None
71,1230910779827859456,Life Without Plastic,LifeWoutPlastic,1,Tim Horton's annual contest just got a lot greener https://t.co/P5rRDySymf,2020-02-21 17:42:53,3,[],2971,,Twitter for iPhone,None,None,None
72,1228344563703721985,Life Without Plastic,LifeWoutPlastic,0,"Plastic waste is a problem, but wasting what the plastic is wrapping is many times worse. https://t.co/8dtbvpAQiI Yes, we must think holistically about the plastic problem - it is one of many...",2020-02-14 15:45:40,6,[],2971,,Twitter for iPhone,None,None,None
73,1228082361901953025,Life Without Plastic,LifeWoutPlastic,1,"A reusable bag that is compact, repairable, washable and more! Get a sneak peak at this new product and upcoming promotions in our newsletter. https://t.co/RZQ4xwRQyz

#plasticfree #reuse #zerowastegroceries #zerowasteliving https://t.co/Xmy2uQEQas",2020-02-13 22:23:46,4,"[{'text': 'plasticfree', 'indices': [168, 180]}, {'text': 'reuse', 'indices': [181, 187]}, {'text': 'zerowastegroceries', 'indices': [188, 207]}, {'text': 'zerowasteliving', 'indices': [208, 224]}]",2971,,Planable,None,None,None
74,1225779144870551553,Life Without Plastic,LifeWoutPlastic,1,Delta's uniform debacle proves how toxic clothes can be https://t.co/R6IR8yOUlF Another reason to avoid synthetic clothing...,2020-02-07 13:51:36,1,[],2971,,Twitter for iPhone,None,None,None
75,1224752557156896768,Life Without Plastic,LifeWoutPlastic,3,Zero waste depends on where you live https://t.co/qHizKFpvvg,2020-02-04 17:52:19,6,[],2971,,Twitter for iPhone,None,None,None
76,1224361076243955712,Life Without Plastic,LifeWoutPlastic,11,Canada moves forward with its single-use plastics ban https://t.co/f5fNNk92Bk,2020-02-03 15:56:42,16,[],2971,,Twitter for iPhone,None,None,None
77,1222143050547331073,Life Without Plastic,LifeWoutPlastic,1,What’s the most ethical way to store leftovers? https://t.co/AfMyQ3HixY via @grist,2020-01-28 13:03:04,0,[],2971,,Twitter for iPhone,None,None,None
78,1220792066114048008,Life Without Plastic,LifeWoutPlastic,1,Read our newsletter - A new tool to give you leverage in 2020 - A job offer - and more https://t.co/90syjFnxO5 https://t.co/0RT8PjLhHs,2020-01-24 19:34:44,0,[],2971,,Mailchimp,None,None,None
79,1220342328247955456,Life Without Plastic,LifeWoutPlastic,2,How our thinking changed in 2019: recycling and plastics https://t.co/dgijUdxP6R,2020-01-23 13:47:38,4,[],2971,,Twitter for iPhone,None,None,None
80,1220341944339062784,Life Without Plastic,LifeWoutPlastic,4,France begins radical plan to phase out single-use plastic https://t.co/I7npGXkvCu,2020-01-23 13:46:07,15,[],2971,,Twitter for iPhone,None,None,None
81,1219270675204124673,Life Without Plastic,LifeWoutPlastic,2,6 zero-waste lessons from Paris https://t.co/gAWwmsJf2T,2020-01-20 14:49:16,4,[],2971,,Twitter for iPhone,None,None,None
