,tweet_id,name,screen_name,retweet_count,text,created_at,favourite_count,hashtags,status_count,location,source_device,retweet_text,quote_text,quote_screen_name
1482,649233359407828992,Life Without Plastic,LifeWoutPlastic,0,Waxworm Bacteria That Digest Polystyrene Plastic http://t.co/5CYNDlwWrL via @nbcnews,2015-09-30 14:44:29,4,[],2971,,Twitter Web Client,None,None,None
1483,649230283116519424,Life Without Plastic,LifeWoutPlastic,0,Ocean Conservancy releases report outlining solutions to issue of plasti... http://t.co/SJ6aUCj1h2 via @EurekAlertAAAS,2015-09-30 14:32:16,0,[],2971,,Twitter Web Client,None,None,None
1484,648892301197111298,Life Without Plastic,LifeWoutPlastic,0,Thrilled &amp; honoured to be the 2014 grand prize winners of this inspiring contest! Share your actions &amp; go for it! https://t.co/ueLmx8CQWi,2015-09-29 16:09:15,2,[],2971,,Twitter Web Client,None,None,None
1485,648865947118399488,Life Without Plastic,LifeWoutPlastic,0,Does BPA make mice daughters lazy? http://t.co/U9pa2WuzNt via @FuturityNews,2015-09-29 14:24:31,0,[],2971,,Twitter Web Client,None,None,None
1486,648596850052874240,Life Without Plastic,LifeWoutPlastic,0,@ZeroWasteChef Thanks Anne-Marie - this is a very important study! @PlasticfreeBeth,2015-09-28 20:35:14,1,[],2971,,Twitter Web Client,None,None,None
1487,648596669890756609,Life Without Plastic,LifeWoutPlastic,3,RT @ZeroWasteChef: #Stanford study shows school meals may expose kids to unsafe levels of #BPA http://t.co/n1T1KddoZJ @PlasticfreeBeth @Lif…,2015-09-28 20:34:31,0,"[{'text': 'Stanford', 'indices': [19, 28]}, {'text': 'BPA', 'indices': [90, 94]}]",2971,,Twitter Web Client,#Stanford study shows school meals may expose kids to unsafe levels of #BPA http://t.co/n1T1KddoZJ @PlasticfreeBeth @LifeWoutPlastic,None,None
1488,648564483196104704,Life Without Plastic,LifeWoutPlastic,0,Papal Command Center Reduces Plastic Footprint http://t.co/P6qSaCO6gS,2015-09-28 18:26:37,2,[],2971,,Twitter Web Client,None,None,None
1489,648564398370459648,Life Without Plastic,LifeWoutPlastic,0,The Synchronicity of Beachcombing http://t.co/07aWblFDxz,2015-09-28 18:26:16,1,[],2971,,Twitter Web Client,None,None,None
1490,648564324752076800,Life Without Plastic,LifeWoutPlastic,1,Is This a New Silent Spring? http://t.co/oWjcTVsveY,2015-09-28 18:25:59,1,[],2971,,Twitter Web Client,None,None,None
1491,648564239934844928,Life Without Plastic,LifeWoutPlastic,0,How Much Trash is Really at Your Beach? http://t.co/hTATXuESUY,2015-09-28 18:25:39,0,[],2971,,Twitter Web Client,None,None,None
1492,648473747536670720,Life Without Plastic,LifeWoutPlastic,0,"@smushface Sorry, no hangers at the moment. Not sure what u mean about the loop/display. Just tested and all ok. Where on the site were u?",2015-09-28 12:26:04,0,[],2971,,Twitter Web Client,None,None,None
1493,648156653251133440,Life Without Plastic,LifeWoutPlastic,1,RT @T_ShirtBags: Furniture-free Grain-free Plastic-free nature birthday party @NutritiousMvmnt https://t.co/Ge215rJEkw @LifeWoutPlastic @Pl…,2015-09-27 15:26:02,0,[],2971,,Twitter Web Client,Furniture-free Grain-free Plastic-free nature birthday party @NutritiousMvmnt https://t.co/Ge215rJEkw @LifeWoutPlastic @PlasticfreeBeth,None,None
1494,648156379384033281,Life Without Plastic,LifeWoutPlastic,1,RT @aquarianbath: The #PlasticFree living Daily is out! http://t.co/QUUjC4X52N Stories via @DelloyeCoiteux @InspectorPlanet @LifeWoutPlastic,2015-09-27 15:24:57,0,"[{'text': 'PlasticFree', 'indices': [22, 34]}]",2971,,Twitter Web Client,The #PlasticFree living Daily is out! http://t.co/QUUjC4X52N Stories via @DelloyeCoiteux @InspectorPlanet @LifeWoutPlastic,None,None
1495,648156123686674436,Life Without Plastic,LifeWoutPlastic,1,RT @warriorsheart12: The Warriors Heart Newstand is out! http://t.co/wr9GA0Lptz Stories via @101fundraising @LifeWoutPlastic @salvos,2015-09-27 15:23:56,0,[],2971,,Twitter Web Client,The Warriors Heart Newstand is out! http://t.co/wr9GA0Lptz Stories via @101fundraising @LifeWoutPlastic @salvos,None,None
1496,648136172330463232,Life Without Plastic,LifeWoutPlastic,2,"Our latest news, specials and blogpost - learn and live with less plastic! http://t.co/BNyNKn40M3 http://t.co/8QpxytwfFj",2015-09-27 14:04:39,6,[],2971,,Constant Contact,None,None,None
1497,647480470872162304,Life Without Plastic,LifeWoutPlastic,1,Plastic in the food chain: Artificial debris found in fish https://t.co/GOqhkAVXyd #plasticfree,2015-09-25 18:39:08,0,"[{'text': 'plasticfree', 'indices': [83, 95]}]",2971,,Twitter Web Client,None,None,None
1498,647452044379443200,Life Without Plastic,LifeWoutPlastic,1,"RT @naturalpod: Forest Stewardship Council (FSC) Friday is an annual, international celebration of responsible forestry! All our... http://…",2015-09-25 16:46:11,0,[],2971,,Twitter Web Client,"Forest Stewardship Council (FSC) Friday is an annual, international celebration of responsible forestry! All our... http://t.co/HegjO1WRFV",None,None
1499,647408368043327488,Life Without Plastic,LifeWoutPlastic,1,RT @crazyapes: Just stumbled on @LifeWoutPlastic website. Love it! I cannot wait to place an order.,2015-09-25 13:52:37,0,[],2971,,Twitter Web Client,Just stumbled on @LifeWoutPlastic website. Love it! I cannot wait to place an order.,None,None
1500,647408301681049601,Life Without Plastic,LifeWoutPlastic,0,@crazyapes Thanks so much for your kind words and support! Feel free to check out our latest newsletter. http://t.co/BNyNKn40M3,2015-09-25 13:52:22,1,[],2971,,Twitter Web Client,None,None,None
1501,647406610999078913,Life Without Plastic,LifeWoutPlastic,1,"Hey waiter, this fish tastes like plastic! http://t.co/qfTSrTOnAG via @SFGate",2015-09-25 13:45:38,0,[],2971,,Twitter Web Client,None,None,None
1502,647397267436122112,Life Without Plastic,LifeWoutPlastic,2,"More stunning plastic pollution art - powerful water bottle whale sculpture in Bristol
http://t.co/rSfMgPWJDa http://t.co/98nA6nkyqn",2015-09-25 13:08:31,0,[],2971,,Twitter Web Client,None,None,None
1503,647394685221257217,Life Without Plastic,LifeWoutPlastic,0,Say Something About Plastic Pollution http://t.co/MdW8iEn5q5 via @HuffPostImpact,2015-09-25 12:58:15,1,[],2971,,Twitter Web Client,None,None,None
1504,647392865115611136,Life Without Plastic,LifeWoutPlastic,0,Judge overturns NYC 'Styrofoam' ban via industry initiated lawsuit @TreeHugger http://t.co/jGRy8jEime #plasticfree http://t.co/IvX4CTuNbG,2015-09-25 12:51:01,0,"[{'text': 'plasticfree', 'indices': [102, 114]}]",2971,,Twitter Web Client,None,None,None
1505,647391203886006272,Life Without Plastic,LifeWoutPlastic,1,"Ecofund Prophecy photos highlight envtl destruction in Senegal - much via plastic pollution
http://t.co/usNt8EPP9h http://t.co/KezeP4ZCIP",2015-09-25 12:44:25,0,[],2971,,Twitter Web Client,None,None,None
1506,647042009694367744,Life Without Plastic,LifeWoutPlastic,3,Our latest newsletter... and saucy new snack container! http://t.co/BNyNKn40M3 http://t.co/OZmUlDEBlU,2015-09-24 13:36:51,7,[],2971,,Constant Contact,None,None,None
1507,645892810164555777,Life Without Plastic,LifeWoutPlastic,3,RT @creeksidecomms: Help get microbeads out of our waterways: I signed on to #BanTheBead with @storyofstuff. http://t.co/9sFQKeTX2p @LifeWo…,2015-09-21 09:30:20,0,"[{'text': 'BanTheBead', 'indices': [77, 88]}]",2971,,Twitter Web Client,Help get microbeads out of our waterways: I signed on to #BanTheBead with @storyofstuff. http://t.co/9sFQKeTX2p @LifeWoutPlastic,None,None
1508,645275299920355328,Life Without Plastic,LifeWoutPlastic,1,Our products are being presented at #expoeast2015 by econaturalexchange our new wholesale platform.… https://t.co/GyOKGlCM53,2015-09-19 16:36:34,1,"[{'text': 'expoeast2015', 'indices': [36, 49]}]",2971,,Instagram,None,None,None
1509,645227963844313088,Life Without Plastic,LifeWoutPlastic,3,"Are u in California? It's Coastal Cleanup Day today, happening right now - go 4 it! #coastalcleanupday #plasticfree https://t.co/TWpQUs7ib7",2015-09-19 13:28:28,4,"[{'text': 'coastalcleanupday', 'indices': [84, 102]}, {'text': 'plasticfree', 'indices': [103, 115]}]",2971,,Twitter Web Client,None,None,None
1510,644951731630116864,Life Without Plastic,LifeWoutPlastic,5,Infographic on eco impact of single use water bottles via @wheelsforwishes http://t.co/nGG7dkAekP #plasticfree http://t.co/XEzI4RMx8C,2015-09-18 19:10:50,1,"[{'text': 'plasticfree', 'indices': [98, 110]}]",2971,,Twitter Web Client,None,None,None
1511,644871577113374721,Life Without Plastic,LifeWoutPlastic,3,RT @gogreenandme: Are plastic food containers poisoning us? http://t.co/QTgyC7Tel7 @LifeWoutPlastic #greenandme http://t.co/odoFIrQsXv,2015-09-18 13:52:19,0,"[{'text': 'greenandme', 'indices': [100, 111]}]",2971,,Twitter Web Client,Are plastic food containers poisoning us? http://t.co/QTgyC7Tel7 @LifeWoutPlastic #greenandme http://t.co/odoFIrQsXv,None,None
1512,644868153168797697,Life Without Plastic,LifeWoutPlastic,4,Over 800 trillion microbeads enter US wastewater daily : http://t.co/gXCQOEtAco,2015-09-18 13:38:43,2,[],2971,,Twitter Web Client,None,None,None
1513,644173840952750081,Life Without Plastic,LifeWoutPlastic,3,"More than half the world’s sea turtles have eaten plastic, new study claims http://t.co/3JW5HXjP6L",2015-09-16 15:39:46,2,[],2971,,Twitter Web Client,None,None,None
1514,643626739571249152,Life Without Plastic,LifeWoutPlastic,1,Ban the use of plastic packaging for organic produce http://t.co/Yd4fMqWtjQ via @Change,2015-09-15 03:25:47,1,[],2971,,Twitter Web Client,None,None,None
1515,643428183681933312,Life Without Plastic,LifeWoutPlastic,2,RT @EmmaSAanne: What happens to plastic when you throw it away? My @TED_ED vid in collaboration with the wonderful @colmanAnimation http://…,2015-09-14 14:16:47,0,[],2971,,Twitter Web Client,What happens to plastic when you throw it away? My @TED_ED vid in collaboration with the wonderful @colmanAnimation http://t.co/VnxCuW8uhy,None,None
1516,643428103805607936,Life Without Plastic,LifeWoutPlastic,1,"RT @rebecca_altman: The lifecycle of most #plastic bottles is a ""cruel purgatory."" @5gyres @LifeWoutPlastic @driftersproject  https://t.co/…",2015-09-14 14:16:28,0,"[{'text': 'plastic', 'indices': [42, 50]}]",2971,,Twitter Web Client,"The lifecycle of most #plastic bottles is a ""cruel purgatory."" @5gyres @LifeWoutPlastic @driftersproject  https://t.co/KLAKGeJsSv",None,None
1517,643428031709716480,Life Without Plastic,LifeWoutPlastic,1,RT @warriorsheart12: The Warriors Heart Newstand is out! http://t.co/ya9OqSncpC Stories via @unicefaustralia @looktothestars @LifeWoutPlast…,2015-09-14 14:16:11,0,[],2971,,Twitter Web Client,The Warriors Heart Newstand is out! http://t.co/ya9OqSncpC Stories via @unicefaustralia @looktothestars @LifeWoutPlastic,None,None
1518,643427663944806400,Life Without Plastic,LifeWoutPlastic,3,RT @las930: We All Could Use A Life Without Plastic @LifeWoutPlastic http://t.co/MPNN66L9bm http://t.co/pYBYwBaZ7o,2015-09-14 14:14:44,0,[],2971,,Twitter Web Client,We All Could Use A Life Without Plastic @LifeWoutPlastic http://t.co/MPNN66L9bm http://t.co/pYBYwBaZ7o,None,None
1519,643125475016056832,Life Without Plastic,LifeWoutPlastic,3,RT @implicitweet: .@TriplePundit: Time To Reduce Our #Plastic #Footprint ---&gt; http://t.co/Bg2f7mxaJZ @LifeWoutPlastic @PlasticPollutes http…,2015-09-13 18:13:56,0,"[{'text': 'Plastic', 'indices': [53, 61]}, {'text': 'Footprint', 'indices': [62, 72]}]",2971,,Twitter Web Client,.@TriplePundit: Time To Reduce Our #Plastic #Footprint ---&gt; http://t.co/Bg2f7mxaJZ @LifeWoutPlastic @PlasticPollutes http://t.co/kxDM79y4Gc,None,None
1520,642695541353263104,Life Without Plastic,LifeWoutPlastic,0,My friend Anne Winship who has this local #fairtrade #coffee business called Beanfair told me the… https://t.co/entQesOkQY,2015-09-12 13:45:32,0,"[{'text': 'fairtrade', 'indices': [42, 52]}, {'text': 'coffee', 'indices': [53, 60]}]",2971,,Instagram,None,None,None
1521,641086493424005121,Life Without Plastic,LifeWoutPlastic,1,RT @plasticSrubbish: @TriplePundit @Pip_Squeaking @implicitweet @LifeWoutPlastic @PlasticPollutes loads of plastic free stuff &amp; tips here h…,2015-09-08 03:11:45,0,[],2971,,Twitter Web Client,@TriplePundit @Pip_Squeaking @implicitweet @LifeWoutPlastic @PlasticPollutes loads of plastic free stuff &amp; tips here http://t.co/OWDd0AYXbY,None,None
1522,640858406912421889,Life Without Plastic,LifeWoutPlastic,3,RT @TriplePundit: Time To Reduce Our #Plastic #Footprint ---&gt; http://t.co/VWQeXlZD6n @implicitweet @LifeWoutPlastic @PlasticPollutes,2015-09-07 12:05:25,0,"[{'text': 'Plastic', 'indices': [37, 45]}, {'text': 'Footprint', 'indices': [46, 56]}]",2971,,Twitter Web Client,Time To Reduce Our #Plastic #Footprint ---&gt; http://t.co/VWQeXlZD6n @implicitweet @LifeWoutPlastic @PlasticPollutes,None,None
1523,640242370378907648,Life Without Plastic,LifeWoutPlastic,1,Fabulous news! Congrats and thanks for all your hard work @5gyres and the whole team! #banthebead https://t.co/kaEzkE0lap,2015-09-05 19:17:30,4,"[{'text': 'banthebead', 'indices': [86, 97]}]",2971,,Twitter Web Client,None,None,None
1524,639621484080705536,Life Without Plastic,LifeWoutPlastic,5,Poignant overview of plastic problem + ways 2 reduce your plastic use by @PlasticPollutes CEO http://t.co/wn6Fz3F7nr http://t.co/vw6SP3Carh,2015-09-04 02:10:20,8,[],2971,,Twitter Web Client,None,None,None
1525,639607173052547072,Life Without Plastic,LifeWoutPlastic,18,RT @3blnow: Time To Reduce Our ‘Plastic Footprint’ http://t.co/3XNYAhU9jN @implicitweet @LifeWoutPlastic @PlasticPollutes,2015-09-04 01:13:28,0,[],2971,,Twitter Web Client,Time To Reduce Our ‘Plastic Footprint’ http://t.co/3XNYAhU9jN @implicitweet @LifeWoutPlastic @PlasticPollutes,None,None
1526,639152427531419648,Life Without Plastic,LifeWoutPlastic,6,"Plastic will be found in 99% of seabirds by 2050, study finds via @TreeHugger http://t.co/H9pQfMpJrf #plasticfree http://t.co/0BgfqjbcPb",2015-09-02 19:06:28,3,"[{'text': 'plasticfree', 'indices': [101, 113]}]",2971,,Twitter Web Client,None,None,None
1527,638835110033276928,Life Without Plastic,LifeWoutPlastic,5,Ship recyclables across the country/world or landfill locally? Umbra from @grist illuminates...http://t.co/Z0sqrtpvot http://t.co/6D4bCwBDde,2015-09-01 22:05:33,3,[],2971,,Twitter Web Client,None,None,None
1528,638764510304673793,Life Without Plastic,LifeWoutPlastic,4,RT @joehoare: Seabirds 'blighted by plastic waste' @litterART1 @PlasticOceans @LifeWoutPlastic  http://t.co/GfnZ2URgm9,2015-09-01 17:25:01,0,[],2971,,Twitter Web Client,Seabirds 'blighted by plastic waste' @litterART1 @PlasticOceans @LifeWoutPlastic  http://t.co/GfnZ2URgm9,None,None
1529,638561926855958528,Life Without Plastic,LifeWoutPlastic,0,Today is the last day of our free shipping offer! http://t.co/wvoll99UqY http://t.co/wbzskdIR5G,2015-09-01 04:00:01,1,[],2971,,Constant Contact,None,None,None
1530,638473571061399552,Life Without Plastic,LifeWoutPlastic,4,RT @Tucker_House: Make your lunch plastic-free! Ty @LifeWoutPlastic for the #GreenGala2015 donation! #BacktoSchool #eco #greencity #ott htt…,2015-08-31 22:08:56,0,"[{'text': 'GreenGala2015', 'indices': [76, 90]}, {'text': 'BacktoSchool', 'indices': [101, 114]}, {'text': 'eco', 'indices': [115, 119]}, {'text': 'greencity', 'indices': [120, 130]}, {'text': 'ott', 'indices': [131, 135]}]",2971,,Twitter Web Client,Make your lunch plastic-free! Ty @LifeWoutPlastic for the #GreenGala2015 donation! #BacktoSchool #eco #greencity #ott http://t.co/0ajaBpyy0d,None,None
1531,638199579142438913,Life Without Plastic,LifeWoutPlastic,0,Two more days for our free shipping offer... http://t.co/wvoll99UqY http://t.co/XDWHZgkb3o,2015-08-31 04:00:11,0,[],2971,,Constant Contact,None,None,None
1532,637322491283816448,Life Without Plastic,LifeWoutPlastic,0,Forgot something for back-to-school? Have it shipped free. http://t.co/wvoll99UqY http://t.co/eA9Of7XWMa,2015-08-28 17:54:57,0,[],2971,,Constant Contact,None,None,None
1533,637322486317752320,Life Without Plastic,LifeWoutPlastic,1,Check out our most recent newsletter! http://t.co/wvoll99UqY http://t.co/UbhkI8esZ7,2015-08-28 17:54:56,1,[],2971,,Constant Contact,None,None,None
1534,636929574786482176,Life Without Plastic,LifeWoutPlastic,0,Breast-feeding encouraged in face of new findings on chemical exposure via breast milk: http://t.co/51YqY5Ojk5,2015-08-27 15:53:38,1,[],2971,,Twitter Web Client,None,None,None
1535,636911630186582016,Life Without Plastic,LifeWoutPlastic,0,Our son's first official day of junior high school... With his #plasticfree #lunchbag and #jute and… https://t.co/Ptu5D4Y2Wa,2015-08-27 14:42:20,2,"[{'text': 'plasticfree', 'indices': [63, 75]}, {'text': 'lunchbag', 'indices': [76, 85]}, {'text': 'jute', 'indices': [90, 95]}]",2971,,Instagram,None,None,None
1536,636893347051892736,Life Without Plastic,LifeWoutPlastic,1,10 more easy useful tips 4 living w/ less plastic via @TreeHugger ​e.g. stop chewing gum &amp; eat an ice cream cone... http://t.co/iBKHLZ1vFD,2015-08-27 13:29:41,1,[],2971,,Twitter Web Client,None,None,None
1537,636692808783503360,Life Without Plastic,LifeWoutPlastic,2,RT @YouAsACook: Why ‘BPA-free’ label on kid’s lunch box isn’t safety guarantee http://t.co/yGirG8Uqwt @PlasticfreeBeth | @LifeWoutPlastic b…,2015-08-27 00:12:49,0,[],2971,,Twitter Web Client,Why ‘BPA-free’ label on kid’s lunch box isn’t safety guarantee http://t.co/yGirG8Uqwt @PlasticfreeBeth | @LifeWoutPlastic best #sandwich box,None,None
1538,634723670146027520,Life Without Plastic,LifeWoutPlastic,0,"10 ways 2 pack your kids a more sustainable lunch via @TreeHugger not just re containers. Think food, toxins, seasons http://t.co/zOoBkkbH5T",2015-08-21 13:48:10,1,[],2971,,Twitter Web Client,None,None,None
1539,634650980689313792,Life Without Plastic,LifeWoutPlastic,1,"RT @Slayermarina: http://t.co/dSYLvxbQJm
@PlasticFreeJuly @LifeWoutPlastic @BiopacLtd @WestBriton http://t.co/Xp4eZzxhLc",2015-08-21 08:59:19,0,[],2971,,Twitter Web Client,"http://t.co/dSYLvxbQJm
@PlasticFreeJuly @LifeWoutPlastic @BiopacLtd @WestBriton http://t.co/Xp4eZzxhLc",None,None
1540,634410142038102017,Life Without Plastic,LifeWoutPlastic,1,We call it the perfect sandwich box... As far as we know it is the only airtight non-plastic sandwich… https://t.co/9TcnW8vD73,2015-08-20 17:02:19,0,[],2971,,Instagram,None,None,None
1541,634373325553303553,Life Without Plastic,LifeWoutPlastic,1,RT @Tucker_House: A big TY to @LifeWoutPlastic for donating to #GreenGala2015 again this year! #communityspirit #supportlocal #ecofriendly …,2015-08-20 14:36:01,0,"[{'text': 'GreenGala2015', 'indices': [63, 77]}, {'text': 'communityspirit', 'indices': [95, 111]}, {'text': 'supportlocal', 'indices': [112, 125]}, {'text': 'ecofriendly', 'indices': [126, 138]}]",2971,,Twitter Web Client,A big TY to @LifeWoutPlastic for donating to #GreenGala2015 again this year! #communityspirit #supportlocal #ecofriendly #itseasybeinggreen,None,None
1542,634010857970737152,Life Without Plastic,LifeWoutPlastic,2,"How to take action on plastic waste: walk your dog, or yourself, around town. Via @TreeHugger http://t.co/aY091lf4TH http://t.co/VrDlnoswVc",2015-08-19 14:35:42,1,[],2971,,Twitter Web Client,None,None,None
1543,633633309210378240,Life Without Plastic,LifeWoutPlastic,2,Water cooler talk: Should our office ditch that big fat upside down jug? http://t.co/qtiYFIV4tm via @grist,2015-08-18 13:35:27,0,[],2971,,Twitter Web Client,None,None,None
1544,633633277262319616,Life Without Plastic,LifeWoutPlastic,0,Does it matter if my salad greens come in a bag or a box? http://t.co/VAnF2whIgF via @grist,2015-08-18 13:35:20,0,[],2971,,Twitter Web Client,None,None,None
1545,633632470441832448,Life Without Plastic,LifeWoutPlastic,3,How much plastic is in our oceans? Ask the woman trying to clean it up http://t.co/QZxQGVH8n3 via @grist @5gyres #plasticfree,2015-08-18 13:32:07,0,"[{'text': 'plasticfree', 'indices': [113, 125]}]",2971,,Twitter Web Client,None,None,None
1546,633632135748976640,Life Without Plastic,LifeWoutPlastic,0,"How microbes can make plastic from sunshine, carbon, and a little bit of love http://t.co/G3UZrhJxh5 via @grist",2015-08-18 13:30:48,0,[],2971,,Twitter Web Client,None,None,None
1547,633631131439656960,Life Without Plastic,LifeWoutPlastic,8,"10 handy easy tips 4 living w/ less plastic, thoughtfully curated by @TreeHugger http://t.co/VzaewQKyYd #plasticfree http://t.co/04kFyMXLHk",2015-08-18 13:26:48,3,"[{'text': 'plasticfree', 'indices': [104, 116]}]",2971,,Twitter Web Client,None,None,None
1548,633266125225218048,Life Without Plastic,LifeWoutPlastic,0,"Do the ""shade balls"" actually save water? Maybe we need a life cycle analysis.: http://t.co/tNyBGpkGqt  ...and a plastic pollution analysis!",2015-08-17 13:16:24,0,[],2971,,Twitter Web Client,None,None,None
1549,633240511281778688,Life Without Plastic,LifeWoutPlastic,1,RT @SS_Living: Sustainability Tip#8 Avoid #plastic! #Sydney #SustainableLiving @PlasticFreeJuly @LifeWoutPlastic @ZeroPlasticWeek http://t.…,2015-08-17 11:34:37,0,"[{'text': 'plastic', 'indices': [42, 50]}, {'text': 'Sydney', 'indices': [52, 59]}, {'text': 'SustainableLiving', 'indices': [60, 78]}]",2971,,Twitter Web Client,Sustainability Tip#8 Avoid #plastic! #Sydney #SustainableLiving @PlasticFreeJuly @LifeWoutPlastic @ZeroPlasticWeek http://t.co/gCgIBhym4s,None,None
1550,632982030993739777,Life Without Plastic,LifeWoutPlastic,0,"@AbundantCity Sorry, not taking preorders, but u can sign up for back in stock notice (just under ""out of stock""): http://t.co/NEcCwFVarZ",2015-08-16 18:27:31,0,[],2971,,Twitter Web Client,None,None,None
1551,632978907575226368,Life Without Plastic,LifeWoutPlastic,0,@AbundantCity Great 2 hear from u! They're coming - late September or early Oct. Sorry for the delay - thx 4 your interest. Happy gardening!,2015-08-16 18:15:06,0,[],2971,,Twitter Web Client,None,None,None
1552,632021232217624577,Life Without Plastic,LifeWoutPlastic,2,RT @SIGGofficial: @YouAsACook Rise Above Plastic...RE-USE! @SIGGofficial @PlasticfreeBeth @MikeHudema @CleantheWorld @LifeWoutPlastic http:…,2015-08-14 02:49:38,0,[],2971,,Twitter Web Client,@YouAsACook Rise Above Plastic...RE-USE! @SIGGofficial @PlasticfreeBeth @MikeHudema @CleantheWorld @LifeWoutPlastic http://t.co/rYVftDKmGy,None,None
1553,632011545925558272,Life Without Plastic,LifeWoutPlastic,2,RT @goodnessmetweet: @jaywoutplastic We agree w/ life w/o plastic! Our article explains it's bad for our health! Pls share if you like: htt…,2015-08-14 02:11:09,0,[],2971,,Twitter Web Client,@jaywoutplastic We agree w/ life w/o plastic! Our article explains it's bad for our health! Pls share if you like: http://t.co/DdEeK7CRl8,None,None
1554,629647455412486144,Life Without Plastic,LifeWoutPlastic,0,"@CureT1Diabetes At the moment no, we don't have a non-wool version. Perhaps down the road. Thx for your interest.",2015-08-07 13:37:06,0,[],2971,,Twitter Web Client,None,None,None
1555,629619880917094400,Life Without Plastic,LifeWoutPlastic,0,"As far as we know, this is the only #plasticfree insulated lunch bag in there market. Made out of… https://t.co/kx70lveEOG",2015-08-07 11:47:32,1,"[{'text': 'plasticfree', 'indices': [36, 48]}]",2971,,Instagram,None,None,None
1556,628913257307353088,Life Without Plastic,LifeWoutPlastic,4,Canada to say 'no thanks' to plastic microbeads in personal care products: http://t.co/QGEMKkzUu9,2015-08-05 12:59:39,3,[],2971,,Twitter Web Client,None,None,None
1557,628316015168987136,Life Without Plastic,LifeWoutPlastic,5,RT @T_ShirtBags: EGO vs. ECO https://t.co/zwoY2PQ7jA @LifeWoutPlastic @laurentbaheux @aquarianbath @earthguardianz @Lunapads @MissionBlue @…,2015-08-03 21:26:26,0,[],2971,,Twitter Web Client,EGO vs. ECO https://t.co/zwoY2PQ7jA @LifeWoutPlastic @laurentbaheux @aquarianbath @earthguardianz @Lunapads @MissionBlue @PlasticFreeJuly,None,None
1558,627913008602333184,Life Without Plastic,LifeWoutPlastic,3,"DAYS 5-10 @Trashis4Tossers 0 waste road trip...Yellowstone e.p.i.p.h.a.n.i.e.s re what we need
http://t.co/OxxVg5kQX5 http://t.co/8jsWpteXyT",2015-08-02 18:45:01,7,[],2971,,Twitter Web Client,None,None,None
1559,627871796302323712,Life Without Plastic,LifeWoutPlastic,1,"@isachoquet @zerowastehome Likewise! Change is the norm, can b fun if 1 embraces it (even 4 a company), &amp; the only way 4ward in our opinion.",2015-08-02 16:01:16,0,[],2971,,Twitter Web Client,None,None,None
1560,627865669305036800,Life Without Plastic,LifeWoutPlastic,0,"@isachoquet @zerowastehome Yes, absolutely - we highlighted it in our last newletter... http://t.co/xnZ7Jw3kpq http://t.co/tycAzVB76U",2015-08-02 15:36:55,0,[],2971,,Twitter Web Client,None,None,None
1561,627864810072489984,Life Without Plastic,LifeWoutPlastic,1,RT @warriorsheart12: The Warriors Heart Newstand is out! http://t.co/7UmroSVCjX Stories via @LifeWoutPlastic @KosherVeg,2015-08-02 15:33:30,0,[],2971,,Twitter Web Client,The Warriors Heart Newstand is out! http://t.co/7UmroSVCjX Stories via @LifeWoutPlastic @KosherVeg,None,None
1562,627241450670018560,Life Without Plastic,LifeWoutPlastic,0,"DAY 4 @Trashis4Tossers 0 waste road trip: Chicago! ...eco-food, tea w/out plastic, skatebding
http://t.co/fMFcSt6Gfo http://t.co/JUTbQjN2T9",2015-07-31 22:16:30,2,[],2971,,Twitter Web Client,None,None,None
1563,626796667069599744,Life Without Plastic,LifeWoutPlastic,1,Today &amp; Tomorrow for our Plastic Free July storewide 10% off sale. Code here: http://t.co/xnZ7JvLJ0Q #plasticfree http://t.co/WjDH6qmg7n,2015-07-30 16:49:05,1,"[{'text': 'plasticfree', 'indices': [105, 117]}]",2971,,Twitter Web Client,None,None,None
1564,626795803579969536,Life Without Plastic,LifeWoutPlastic,1,DAY 3 of @Trashis4Tossers 0 waste road trip...making preserves on the road (wow!) http://t.co/YGKcjfFe8B #plasticfree http://t.co/FqokZqJx7E,2015-07-30 16:45:39,2,"[{'text': 'plasticfree', 'indices': [105, 117]}]",2971,,Twitter Web Client,None,None,None
