,tweet_id,name,screen_name,retweet_count,text,created_at,favourite_count,hashtags,status_count,location,source_device,retweet_text,quote_text,quote_screen_name
490,966562706357719041,New Plastics Economy,NewPlasticsEcon,14,"The consumer goods industry needs to take these 4 key actions to accelerate the transition to a #circulareconomy and tackle the 'mounting challenge of ocean plastic waste', says @Unilever CEO @PaulPolman https://t.co/MnoQddGVtv https://t.co/15hDR5WGcv",2018-02-22 06:38:01,17,"[{'text': 'circulareconomy', 'indices': [96, 112]}]",2072,,Buffer,None,None,None
491,966344817235111936,New Plastics Economy,NewPlasticsEcon,8,. @NewPlasticsEcon has awarded these five innovations $1m to prevent ocean plastic – discover how they could do it. https://t.co/2koBS4Ksav https://t.co/bQ7BGEvxFq,2018-02-21 16:12:12,17,[],2072,,Buffer,None,None,None
492,966303017627734016,New Plastics Economy,NewPlasticsEcon,16,Our $2M Innovation Prize aimed to spark innovation for the 50% of plastic packaging items that need fundamental redesign before they can ever be recycled. Find out more: https://t.co/MHzQYRwtuH. #NewPlasticsEconomy https://t.co/ROADaTmGW1,2018-02-21 13:26:07,8,"[{'text': 'NewPlasticsEconomy', 'indices': [195, 214]}]",2072,,Buffer,None,None,None
493,966228264304947200,New Plastics Economy,NewPlasticsEcon,36,"Clean-ups cannot keep pace with the amount of plastic entering the ocean every year. We need to find solutions that deal with the causes of ocean plastic, not just the symptoms. https://t.co/vGMBfDl5BK https://t.co/Pizz6I1mjU",2018-02-21 08:29:04,41,[],2072,,Buffer,None,None,None
494,966200316634062850,New Plastics Economy,NewPlasticsEcon,8,"An ambitious new Chilean initiative will bring together businesses, industry, governments, local authorities, NGOs and society at large, to create a plastic system that works – a #circulareconomy where plastic is valued and never becomes waste. https://t.co/L1sGQupHew https://t.co/fObmyLsdKK",2018-02-21 06:38:01,14,"[{'text': 'circulareconomy', 'indices': [179, 195]}]",2072,,Buffer,None,None,None
495,965982384234618880,New Plastics Economy,NewPlasticsEcon,6,"Why we need to fundamentally rethink how we make, use and reuse plastics. #NewPlasticsEconomy https://t.co/7hWKWEJyPS https://t.co/TRmiJWtaoc",2018-02-20 16:12:02,15,"[{'text': 'NewPlasticsEconomy', 'indices': [74, 93]}]",2072,,Buffer,None,None,None
496,965964730086166529,New Plastics Economy,NewPlasticsEcon,35,RT @KarmenuVella: Please see link to my speech at today's #CEstakeholderEU The event is the ideal place for stakeholders to learn from each…,2018-02-20 15:01:53,0,"[{'text': 'CEstakeholderEU', 'indices': [58, 74]}]",2072,,Twitter for iPhone,Please see link to my speech at today's #CEstakeholderEU The event is the ideal place for stakeholders to learn from each other - and it’s open to all. Thanks for the great reception. https://t.co/EOdGpZbbhk #CircularEconomy https://t.co/9OivjykE4O,None,None
497,965940646015008769,New Plastics Economy,NewPlasticsEcon,16,"A new agreement between the Ellen MacArthur Foundation and @UNEP, signed at #Davos, will help scale up and accelerate the shift towards a #circulareconomy and a #NewPlasticsEconomy. https://t.co/7v1rKRHrkU https://t.co/IsSjPTvC90 https://t.co/2EGDYIGsF5",2018-02-20 13:26:10,37,"[{'text': 'Davos', 'indices': [76, 82]}, {'text': 'circulareconomy', 'indices': [138, 154]}, {'text': 'NewPlasticsEconomy', 'indices': [161, 180]}]",2072,,Buffer,None,None,None
498,965890935816155137,New Plastics Economy,NewPlasticsEcon,5,"Last year, 150+ organisations backed our call for a global ban on oxo-degradable plastics. Read our statement: https://t.co/9XgD5iDTcd https://t.co/FG1HfJihIa",2018-02-20 10:08:39,11,[],2072,,Buffer,None,None,None
499,964532836966567942,New Plastics Economy,NewPlasticsEcon,2,. @CupClub's ambition is to become the city bike rental equivalent of the coffee scene. #circulardesign https://t.co/INpg4TK8bj https://t.co/wSl6yiqkzT,2018-02-16 16:12:03,6,"[{'text': 'circulardesign', 'indices': [88, 103]}]",2072,,Buffer,None,None,None
500,964491064802455552,New Plastics Economy,NewPlasticsEcon,13,"These 11 innovations will tackle the causes of ocean plastic pollution, not just the symptoms, @wef agenda blog via @RobOpsomer. https://t.co/8CZQeHmLZv https://t.co/pytEVMmdvL",2018-02-16 13:26:03,21,[],2072,,Buffer,None,None,None
501,964416339031949312,New Plastics Economy,NewPlasticsEcon,1,Find out how this @PittTweet team used nano-engineering to create recyclable packaging that replaces typical complex multi-layer functions - winners of our $1M #CircularMaterials Challenge. https://t.co/Hgyv9GpwIc https://t.co/BEwktj0r4W,2018-02-16 08:29:07,1,"[{'text': 'CircularMaterials', 'indices': [160, 178]}]",2072,,Buffer,None,None,None
502,964388391809835008,New Plastics Economy,NewPlasticsEcon,5,"Packaging that feels and looks like plastic, but is made from wood. Find out about @VTTFinland's #CircularMaterials Challenge winning innovation. https://t.co/od1m8WD1i4 https://t.co/MoYzvWOsPJ",2018-02-16 06:38:04,3,"[{'text': 'CircularMaterials', 'indices': [97, 115]}]",2072,,Buffer,None,None,None
503,964170482789568512,New Plastics Economy,NewPlasticsEcon,12,We're bringing together key stakeholders to design a plastics system that works based on three principles. 1) Creating an effective after-use market 2) Drastically reduce leakage into the environment. 3) Decouple production from fossil fuels. https://t.co/oyy7Z7lTPi https://t.co/kZn6CAkf1O,2018-02-15 16:12:11,28,[],2072,,Buffer,None,None,None
504,964128689192566784,New Plastics Economy,NewPlasticsEcon,24,"An origami-like technique creates this one piece paper cup, which eliminates the need for single use plastic lids. Find out more about #CircularDesign Challenge winner TrioCup. https://t.co/xB5JzUhkYX https://t.co/g74Hr1EKP1",2018-02-15 13:26:06,57,"[{'text': 'CircularDesign', 'indices': [135, 150]}]",2072,,Buffer,None,None,None
505,964053925073743872,New Plastics Economy,NewPlasticsEcon,20,Multi-layered plastic packaging provides important functions like keeping food fresh but also makes recycling more difficult. Our $2M Innovation Prize targeted the 50% of plastic packaging items that need fundamental redesign. https://t.co/ukYeOZ3pHP https://t.co/hx8y8bXlwV,2018-02-15 08:29:01,26,[],2072,,Buffer,None,None,None
506,964026000702140416,New Plastics Economy,NewPlasticsEcon,10,"An edible or soluble alternative to plastics, designed as an alternative to the thousands of sachets used in restaurant and hospitality businesses. #Circulardesign https://t.co/MXyaZEFeZP https://t.co/hLQ3v2flKA",2018-02-15 06:38:03,9,"[{'text': 'Circulardesign', 'indices': [148, 163]}]",2072,,Buffer,None,None,None
507,963874286778929153,New Plastics Economy,NewPlasticsEcon,9,"We challenged scientists, designers and other innovators to radically rethink how we make, use and reuse plastics. Meet the $2M Innovation Prize winners: https://t.co/BN9OitzE1z #NewPlasticsEconomy https://t.co/iIasSCKVxg",2018-02-14 20:35:12,8,"[{'text': 'NewPlasticsEconomy', 'indices': [178, 197]}]",2072,,Buffer,None,None,None
508,963834014145671168,New Plastics Economy,NewPlasticsEcon,1,Find out how our #CircularMaterials Challenge winner Aronax Technologies used a magnetic coating to replace multi-layered plastic packaging. https://t.co/s0DKdItOSu https://t.co/LDhjgRGRvN,2018-02-14 17:55:10,3,"[{'text': 'CircularMaterials', 'indices': [17, 35]}]",2072,,Buffer,None,None,None
509,963808067379978242,New Plastics Economy,NewPlasticsEcon,45,Seaweed-based packaging that could replace billions of smalls bits of plastics with a nutrient boost. @Evoware were one of our #CircularDesign Challenge winners and are now part of @TBPInnovate accelerator programme. https://t.co/OwoaIPZoso https://t.co/WjpUzaDRV3,2018-02-14 16:12:04,56,"[{'text': 'CircularDesign', 'indices': [127, 142]}]",2072,,Buffer,None,None,None
510,963403897082728448,New Plastics Economy,NewPlasticsEcon,7,"The challenge? To create a stable and cost-competitive supply of recycled plastic so that cars can be manufactured economically and with a low environmental impact.

Explore @Groupe_Renault's #circulareconomy approach here:
https://t.co/sCiZ9r4Evg https://t.co/SQoQwpL0kJ",2018-02-13 13:26:02,8,"[{'text': 'circulareconomy', 'indices': [192, 208]}]",2072,,Buffer,None,None,None
511,963083291497811969,New Plastics Economy,NewPlasticsEcon,2,How do we create systems that work for everyone? @CirculateNews editor Joe Iles speaks to @futurelearning https://t.co/DGmji2E8dT https://t.co/d2nTU6zt14,2018-02-12 16:12:04,1,[],2072,,Buffer,None,None,None
512,963041517333032960,New Plastics Economy,NewPlasticsEcon,5,Major companies are making big changes to realise the economic and environmental benefits of a #newplasticseconomy https://t.co/1GS4zEW14B https://t.co/k0VvmJOzGw,2018-02-12 13:26:04,6,"[{'text': 'newplasticseconomy', 'indices': [95, 114]}]",2072,,Buffer,None,None,None
513,961954340557778944,New Plastics Economy,NewPlasticsEcon,1,Find out more about our work with @UNEP on a new agreement to work towards a circular economy https://t.co/mFmQt2WdZv Via @WEF https://t.co/BRp4kdah8b,2018-02-09 13:26:01,4,[],2072,,Buffer,None,None,None
514,961851694538633218,New Plastics Economy,NewPlasticsEcon,6,"The Ellen MacArthur Foundation is thrilled to have been awarded £400,000 by players of People’s @PostcodeLottery to support its work to accelerate the transition to a circular economy.

 https://t.co/qLf794mX2Q https://t.co/mJ2kmgqkQS",2018-02-09 06:38:08,24,[],2072,,Buffer,None,None,None
515,961591952880881664,New Plastics Economy,NewPlasticsEcon,5,Find out about new #circularmaterials that could help keep plastics in the economy and out of the ocean https://t.co/6BT4jKAvlc Via @thomsonreuters https://t.co/gzdkrQ8TZ4,2018-02-08 13:26:01,12,"[{'text': 'circularmaterials', 'indices': [19, 37]}]",2072,,Buffer,None,None,None
516,961519630908055552,New Plastics Economy,NewPlasticsEcon,20,"11 companies target 100% reusable, recyclable or compostable plastic packaging by 2025. We call on the rest of industry to follow this lead. https://t.co/ZngNdor23K https://t.co/w7wApVJanz",2018-02-08 08:38:38,29,[],2072,,Twitter Web Client,None,None,None
517,961271338559295489,New Plastics Economy,NewPlasticsEcon,18,A new agreement between @circulareconomy and @UNEP will help scale up and accelerate the shift to a #circulareconomy https://t.co/Hwy7DZ6rwh Via @juststyle https://t.co/t3Uas5Ko6V,2018-02-07 16:12:01,15,"[{'text': 'circulareconomy', 'indices': [100, 116]}]",2072,,Buffer,None,None,None
518,961184078497271808,New Plastics Economy,NewPlasticsEcon,3,"When engineers were searching for a solution to problems with Japan’s bullet trains, they turned to #biomimicry. Learn more about how nature and the #circulareconomy can inspire better design. https://t.co/2brGwIkZo0 Via @99piorg and @voxdotcom https://t.co/BgmQNkwlSh",2018-02-07 10:25:16,7,"[{'text': 'biomimicry', 'indices': [100, 111]}, {'text': 'circulareconomy', 'indices': [149, 165]}]",2072,,Buffer,None,None,None
519,961007685754871810,New Plastics Economy,NewPlasticsEcon,1,"Players of People's @PostcodeLottery have supported the New Plastics Economy initiative since its inception, helping to support the bringing together of more than 40 organisations across industry to build a system that works. https://t.co/8pfoxjfT2k https://t.co/0hCGKspqsx",2018-02-06 22:44:21,6,[],2072,,Buffer,None,None,None
520,960908952543391744,New Plastics Economy,NewPlasticsEcon,8,We need to join forces to ‘shock’ our current models of plastics production and consumption - and to reveal the economic and environmental benefits the #circulareconomy can bring. https://t.co/FpIfgcR2nE via @wef https://t.co/aHE4ysAT3F,2018-02-06 16:12:01,11,"[{'text': 'circulareconomy', 'indices': [152, 168]}]",2072,,Buffer,None,None,None
521,960898485632536576,New Plastics Economy,NewPlasticsEcon,24,RT @PaulPolman: Investing in innovative new ways to get products to people could provide a $10 billion global opportunity – and save our oc…,2018-02-06 15:30:26,0,[],2072,,Twitter for Android,"Investing in innovative new ways to get products to people could provide a $10 billion global opportunity – and save our oceans #newplasticseconomy 

https://t.co/4eB4GytRFC",None,None
522,960867177342566400,New Plastics Economy,NewPlasticsEcon,7,"The New Plastics Economy aims to establish initial elements of a ""Global Plastics Protocol"" to address the need for standards in plastics design, use and reuse – crucial to system-wide adoption of materials that can be either reused, recycled or composted. https://t.co/skxOr3HfKE https://t.co/W8Y5ZCVVRx",2018-02-06 13:26:01,20,[],2072,,Buffer,None,None,None
523,960504794438864897,New Plastics Economy,NewPlasticsEcon,42,"Terms such as ‘bioplastic’ or ‘recyclable’ can create confusion and, in the worst case scenario, constitute a safe haven for greenwashing. A ‘Global Plastics Protocol’ is needed, argue @Unilever CEO @PaulPolman and @CircularEconomy’s @EllenMacArthur https://t.co/PB6kzGnYCJ https://t.co/D7MbWQynxm",2018-02-05 13:26:02,72,[],2072,,Buffer,None,None,None
524,959459433498775555,New Plastics Economy,NewPlasticsEcon,8,"We challenged scientists, designers and other innovators to radically rethink how we make, use and reuse plastics. #NewPlasticsEconomy https://t.co/huOLOHxdiR https://t.co/H7YGiYU0yp",2018-02-02 16:12:09,13,"[{'text': 'NewPlasticsEconomy', 'indices': [115, 134]}]",2072,,Buffer,None,None,None
525,959417630955331584,New Plastics Economy,NewPlasticsEcon,8,A team from @Franhofer is creating an organic coating that makes compostable plastic suitable for fresh food packaging. #CircularMaterials https://t.co/qBYMsamg8e https://t.co/sJXkKkV78B,2018-02-02 13:26:02,9,"[{'text': 'CircularMaterials', 'indices': [120, 138]}]",2072,,Buffer,None,None,None
526,959342891113041920,New Plastics Economy,NewPlasticsEcon,7,Davos: The inventions cutting plastic waste. @BBCBusiness covers our #CircularMaterials Challenge winners. #NewPlasticsEconomy https://t.co/zFSritzwsj https://t.co/t4k2yYsJpf,2018-02-02 08:29:03,9,"[{'text': 'CircularMaterials', 'indices': [69, 87]}, {'text': 'NewPlasticsEconomy', 'indices': [107, 126]}]",2072,,Buffer,None,None,None
527,959314950744190977,New Plastics Economy,NewPlasticsEcon,7,The @FT on why leadership from industry is crucial to the transition towards a #NewPlasticsEconomy. https://t.co/6m1QP7AsoZ https://t.co/H6IBa2k7JM,2018-02-02 06:38:02,7,"[{'text': 'NewPlasticsEconomy', 'indices': [79, 98]}]",2072,,Buffer,None,None,None
528,959097017720082432,New Plastics Economy,NewPlasticsEcon,16,"The ambition for 100% reusable, recyclable or compostable plastic packaging by 2025 is an important first step towards a #NewPlasticsEconomy. https://t.co/3AmpLQGXFf https://t.co/FnypEfQ8ZM",2018-02-01 16:12:02,15,"[{'text': 'NewPlasticsEconomy', 'indices': [121, 140]}]",2072,,Buffer,None,None,None
529,959055268955947008,New Plastics Economy,NewPlasticsEcon,5,"Discover how #CircularMaterials Challenge winners @PittTweet are using nano-engineering to create recyclable, flexible and durable materials that could replace existing non-recyclable packaging. https://t.co/etSaMDALMy https://t.co/WaOqG54K0R",2018-02-01 13:26:09,10,"[{'text': 'CircularMaterials', 'indices': [13, 31]}]",2072,,Buffer,None,None,None
530,959030078855368706,New Plastics Economy,NewPlasticsEcon,15,"RT @EcoverUK: Our products are already in 100% reusable, recyclable or compostable packaging. The commitment we’ve signed up to is that by…",2018-02-01 11:46:03,0,[],2072,,Twitter Web Client,"Our products are already in 100% reusable, recyclable or compostable packaging. The commitment we’ve signed up to is that by 2020 all our bottles will be in 100% recycled plastic. #ecover @NewPlasticsEcon",None,None
531,959028320141762560,New Plastics Economy,NewPlasticsEcon,104,"RT @ClarenceHouse: In 2017, The Prince launched the @NewPlasticsEcon Innovation Prize, which aims to help keep plastics out of our oceans.…",2018-02-01 11:39:04,0,[],2072,,Twitter Web Client,"In 2017, The Prince launched the @NewPlasticsEcon Innovation Prize, which aims to help keep plastics out of our oceans.

Learn more about plastic use, recycling and the steps being taken to reduce plastic waste ⬇ https://t.co/pbvDFsY3B2",None,None
532,958980499116056577,New Plastics Economy,NewPlasticsEcon,0,"""These bold ideas aim to make plastic waste a thing of the past"" - @btschiller @FastCompany https://t.co/D7fDXfh2Mg. #NewPlasticsEconomy https://t.co/A3CGJP0PLX",2018-02-01 08:29:02,4,"[{'text': 'NewPlasticsEconomy', 'indices': [117, 136]}]",2072,,Buffer,None,None,None
533,958952570285903872,New Plastics Economy,NewPlasticsEcon,10,Five winning teams share $1M prize to stop plastics from entering our oceans in the first place. #NewPlasticsEconomy #CircularMaterials https://t.co/DXWwnIG2pC https://t.co/krSOPwq3ZI,2018-02-01 06:38:03,9,"[{'text': 'NewPlasticsEconomy', 'indices': [97, 116]}, {'text': 'CircularMaterials', 'indices': [117, 135]}]",2072,,Buffer,None,None,None
534,958750004516196352,New Plastics Economy,NewPlasticsEcon,14,RT @MarcusGover: Honoured to attend summit today organised by HRH The Prince of Wales to update him on a busy year with #plastics. Presente…,2018-01-31 17:13:08,0,"[{'text': 'plastics', 'indices': [120, 129]}]",2072,,Twitter for Android,Honoured to attend summit today organised by HRH The Prince of Wales to update him on a busy year with #plastics. Presented our new cross-sector initiative w @circulareconomy to keep plastics in the economy and out of the ocean. https://t.co/kV9E0bF9v8  @ClarenceHouse @Jo_Royle,None,None
535,958734633063079936,New Plastics Economy,NewPlasticsEcon,2,"Packaging that looks and feels like plastics, but is made from wood – Find out more about @VTTFinland's #CircularMaterials Challenge winning innovation. https://t.co/ZU43X8vLTq https://t.co/sBwm5TY4md",2018-01-31 16:12:03,6,"[{'text': 'CircularMaterials', 'indices': [104, 122]}]",2072,,Buffer,None,None,None
536,958692854104289280,New Plastics Economy,NewPlasticsEcon,1,"In case you missed it, @FT on the problem with plastic and why we need fundamental redesign to create a better plastics system. https://t.co/yQsFkHkMUH #NewPlasticsEconomy https://t.co/BsvzvX4FJp",2018-01-31 13:26:02,9,"[{'text': 'NewPlasticsEconomy', 'indices': [152, 171]}]",2072,,Buffer,None,None,None
537,958618109350498305,New Plastics Economy,NewPlasticsEcon,25,"Despite dedication, innovation and investment, clean-ups cannot keep pace with the rising tide of ocean plastics. We need to radically rethink how we make, use and reuse plastics. #NewPlasticsEconomy https://t.co/sA2xfX6qVZ https://t.co/SuVm1lGzff",2018-01-31 08:29:02,27,"[{'text': 'NewPlasticsEconomy', 'indices': [180, 199]}]",2072,,Buffer,None,None,None
538,958590173633269761,New Plastics Economy,NewPlasticsEcon,9,"We need to radically rethink how we make, use and reuse plastics. Our vision for a plastics system that works. #NewPlasticsEconomy https://t.co/dTBlq2O0Zc https://t.co/x4QC2GAtPC",2018-01-31 06:38:01,16,"[{'text': 'NewPlasticsEconomy', 'indices': [111, 130]}]",2072,,Buffer,None,None,None
539,958372238797008901,New Plastics Economy,NewPlasticsEcon,5,. @dezeen covers the winners of the $1M #CircularMaterials Challenge. Evidence of the fundamental redesign needed to create a plastics economy that works. https://t.co/SnMdXn84VK https://t.co/W57VSqvcqS,2018-01-30 16:12:02,7,"[{'text': 'CircularMaterials', 'indices': [40, 58]}]",2072,,Buffer,None,None,None
540,958330482298703872,New Plastics Economy,NewPlasticsEcon,8,". @FullCycleBio, @ElkPackaging &amp; @associatedLP are working together to create packaging from waste that can be fed to bacteria and turned into new plastic. Learn more about our #CircularMaterials Challenge winners here: https://t.co/fPJseqqjpj https://t.co/0BYEKGYkDy",2018-01-30 13:26:06,16,"[{'text': 'CircularMaterials', 'indices': [181, 199]}]",2072,,Buffer,None,None,None
541,958255798173552641,New Plastics Economy,NewPlasticsEcon,34,"We call on industry to follow the lead of these 11 companies, who are aiming for 100% reusable, recyclable or compostable plastic packaging by 2025. https://t.co/s9KJheX9pS https://t.co/HpyWWTHSmg",2018-01-30 08:29:20,54,[],2072,,Buffer,None,None,None
542,958227787596337152,New Plastics Economy,NewPlasticsEcon,10,"The best way to cut plastic waste? Make recycling unnecessary, @SkyNews coverage of our $2M Innovation Prize. @SkyOceanRescue @skybiggerpic @skybiggerpic https://t.co/lORAfjaLdW https://t.co/6kccJibQf5",2018-01-30 06:38:02,15,[],2072,,Buffer,None,None,None
543,958143258290475009,New Plastics Economy,NewPlasticsEcon,10,"RT @FullCycleBio: Learn how we #rethinkplastics in this feature in @FastCompany! @NewPlasticsEcon @circulareconomy 

https://t.co/hAFjOaXr3j",2018-01-30 01:02:08,0,"[{'text': 'rethinkplastics', 'indices': [31, 47]}]",2072,,Twitter for Android,"Learn how we #rethinkplastics in this feature in @FastCompany! @NewPlasticsEcon @circulareconomy 

https://t.co/hAFjOaXr3j",None,None
544,958017611727626241,New Plastics Economy,NewPlasticsEcon,1,Find out more about the #NewPlasticsEconomy Innovation Prize Winners https://t.co/hiyhK74Z6e … https://t.co/kyVipX1gMB,2018-01-29 16:42:52,12,"[{'text': 'NewPlasticsEconomy', 'indices': [24, 43]}]",2072,,Twitter Web Client,None,None,None
545,958009853762588673,New Plastics Economy,NewPlasticsEcon,3,"Five teams share $1M #CircularMaterials Challenge prize for innovations that represent a fundamental rethink of how we make, use and reuse plastic packaging. https://t.co/D8oCAv1URE https://t.co/aIQQA5mI2I",2018-01-29 16:12:02,4,"[{'text': 'CircularMaterials', 'indices': [21, 39]}]",2072,,Buffer,None,None,None
546,957968074841436161,New Plastics Economy,NewPlasticsEcon,24,Our $2M Innovation Prize aimed to spark innovation for the 50% of plastic packaging items that need fundamental redesign before they can ever be recycled. Find out more: https://t.co/zPPXCNfYnJ. https://t.co/Xl9uzLE1P3,2018-01-29 13:26:01,30,[],2072,,Buffer,None,None,None
547,957939223839076353,New Plastics Economy,NewPlasticsEcon,18,"The recycling symbol was introduced 40 years ago, but still only 14% of all plastic packaging is currently collected for recycling globally, while one third leaks into the environment. The case for a #NewPlasticsEconomy. https://t.co/Ihh8kt5amF https://t.co/n3lObGYLOS",2018-01-29 11:31:23,12,"[{'text': 'NewPlasticsEconomy', 'indices': [200, 219]}]",2072,,Buffer,None,None,None
548,957914206753435648,New Plastics Economy,NewPlasticsEcon,10,"From an innovation standpoint, the hardest nut to crack is the 30% of plastics that can’t currently be reused. That is what the contest aimed to tackle. Via @BTSchiller @FastCompany https://t.co/fsNGsgFMP4 https://t.co/PK0J3aImC3",2018-01-29 09:51:58,9,[],2072,,Buffer,None,None,None
549,957696045391187968,New Plastics Economy,NewPlasticsEcon,18,"""Not every company is going far enough, but we’ve seen a significant change from 18 months ago.""  – @RobOpsomer talks to the @FT about what businesses are doing to create a #circulareconomy for plastics https://t.co/33DDrhgrPR via @financialtimes https://t.co/4XEr7lFV7y",2018-01-28 19:25:05,21,"[{'text': 'circulareconomy', 'indices': [173, 189]}]",2072,,Buffer,None,None,None
550,957590334116126720,New Plastics Economy,NewPlasticsEcon,20,.@NewPlasticsEcon has awarded these five innovations $1m to prevent ocean plastic – discover how they could do it. https://t.co/cV9FWOTdgi https://t.co/0ButyP0MaQ,2018-01-28 12:25:01,31,[],2072,,Buffer,None,None,None
551,957564556812935168,New Plastics Economy,NewPlasticsEcon,37,"RT @WRAP_UK: Alongside @circulareconomy, we’re calling on businesses, governments, local authorities, NGOs, media &amp; society to join us to m…",2018-01-28 10:42:35,0,[],2072,,Twitter for Android,"Alongside @circulareconomy, we’re calling on businesses, governments, local authorities, NGOs, media &amp; society to join us to make sure #plastic packaging doesn’t end up like this. Find out more: https://t.co/SlpAosiqUQ #circularmaterials @NewPlasticsEcon https://t.co/qwzCKFtPKx",None,None
552,957529952823463936,New Plastics Economy,NewPlasticsEcon,19,"The list of leading brands, retailers, and packaging companies working towards using 100% reusable, recyclable or compostable packaging by 2025 or earlier has grown to 11 https://t.co/ffMhKdtNCC https://t.co/BcTFA3TaY8",2018-01-28 08:25:05,26,[],2072,,Buffer,None,None,None
553,957288357159145472,New Plastics Economy,NewPlasticsEcon,20,"Dr Richard Thompson, of the International Marine Litter Research Unit, talks to the @FT about the need for systemic solutions to waste plastic. (Pics by @plasticpieces)
https://t.co/iyd9QREwFQ https://t.co/LtXOAen5M2",2018-01-27 16:25:04,31,[],2072,,Buffer,None,None,None
554,957227949249499136,New Plastics Economy,NewPlasticsEcon,28,"An ambitious new Chilean initiative will bring together businesses, industry, governments, local authorities, NGOs and society at large, to create a plastic system that works – a #circulareconomy where plastic is valued and never becomes waste. https://t.co/ZEnLlGCLuZ https://t.co/dFW1EN1oOs",2018-01-27 12:25:02,35,"[{'text': 'circulareconomy', 'indices': [179, 195]}]",2072,,Buffer,None,None,None
555,957194768806707200,New Plastics Economy,NewPlasticsEcon,1,You can catch up with @RobOpsomer's interview with @GreenBiz here - talking about what happens next for our innovation prize winners https://t.co/b2dZgkDxjK https://t.co/scKPaJ0eqM,2018-01-27 10:13:11,1,[],2072,,Buffer,None,None,None
