,tweet_id,name,screen_name,retweet_count,text,created_at,favourite_count,hashtags,status_count,location,source_device,retweet_text,quote_text,quote_screen_name
970,904628040789086209,New Plastics Economy,NewPlasticsEcon,6,RT @OpenIDEO: The #CircularDesign Challenge Ideas Shortlist is in its Final Review Phase! Help us pick the Top Ideas: https://t.co/uLN8fczV…,2017-09-04 08:51:46,0,"[{'text': 'CircularDesign', 'indices': [18, 33]}]",2072,,Twitter Web Client,The #CircularDesign Challenge Ideas Shortlist is in its Final Review Phase! Help us pick the Top Ideas: https://t.co/uLN8fczV21 https://t.co/e2lA5JMR0y,None,None
971,903556894576529408,New Plastics Economy,NewPlasticsEcon,10,"The New Plastics Economy represents a significant opportunity for businesses, policymakers and innovators. @KarmenuVella @EU_Commission https://t.co/NhTWI4xp12",2017-09-01 09:55:25,12,[],2072,,Buffer,None,None,None
972,903520060047855616,New Plastics Economy,NewPlasticsEcon,12,How might we apply the #circulareconomy to #plastics? #CircularDesign https://t.co/10kkHkPtdd https://t.co/oUNy7zZhki,2017-09-01 07:29:03,12,"[{'text': 'circulareconomy', 'indices': [23, 39]}, {'text': 'plastics', 'indices': [43, 52]}, {'text': 'CircularDesign', 'indices': [54, 69]}]",2072,,Buffer,None,None,None
973,903291478692306944,New Plastics Economy,NewPlasticsEcon,26,. @JohnKerry endorsing the #NewPlasticsEconomy and our $2M Innovation Prize. https://t.co/OyxoJeRNUI https://t.co/b5rE3CJwwM,2017-08-31 16:20:45,30,"[{'text': 'NewPlasticsEconomy', 'indices': [27, 46]}]",2072,,Buffer,None,None,None
974,903194421826641921,New Plastics Economy,NewPlasticsEcon,4,The #CircularMaterials challenge seeks ways to make all plastic packaging recyclable. https://t.co/5v1AXO1wiq https://t.co/AfOx7OQ2aY,2017-08-31 09:55:05,2,"[{'text': 'CircularMaterials', 'indices': [4, 22]}]",2072,,Buffer,None,None,None
975,903165017222258688,New Plastics Economy,NewPlasticsEcon,1,RT @matsllinder: Excited to speak about @NewPlasticsEcon today and tomorrow at #WWWeeek in STOCKHOLM,2017-08-31 07:58:14,0,"[{'text': 'WWWeeek', 'indices': [79, 87]}]",2072,,Twitter Web Client,Excited to speak about @NewPlasticsEcon today and tomorrow at #WWWeeek in STOCKHOLM,None,None
976,903157679039885312,New Plastics Economy,NewPlasticsEcon,10,Rethinking how we make and use plastics. The #NewPlasticsEconomy is made possible by the support of players of People's @PostcodeLottery. https://t.co/Py5kOIcfWm,2017-08-31 07:29:05,15,"[{'text': 'NewPlasticsEconomy', 'indices': [45, 64]}]",2072,,Buffer,None,None,None
977,902870123773648896,New Plastics Economy,NewPlasticsEcon,5,Our #CircularDesign challenge welcomed engagement from @OpenIDEO chapters from around the world. https://t.co/xdXXOyIDwt,2017-08-30 12:26:26,11,"[{'text': 'CircularDesign', 'indices': [4, 19]}]",2072,,Buffer,None,None,None
978,902832030895001600,New Plastics Economy,NewPlasticsEcon,13,Find out more about the #NewPlasticsEconomy and our $2M Innovation Prize. https://t.co/q2BLR4WzpJ https://t.co/6LUkyOQBWY,2017-08-30 09:55:04,8,"[{'text': 'NewPlasticsEconomy', 'indices': [24, 43]}]",2072,,Buffer,None,None,None
979,902795299613278208,New Plastics Economy,NewPlasticsEcon,0,Understand stakeholders perspectives and create narratives to help develop circular buy-in. #CircularDesign https://t.co/gKgS7sH0kb https://t.co/eGei6eEu9y,2017-08-30 07:29:07,1,"[{'text': 'CircularDesign', 'indices': [92, 107]}]",2072,,Buffer,None,None,None
980,902566656710291461,New Plastics Economy,NewPlasticsEcon,12,We had 600+ contributions to our #CircularDesign challenge w. innovators rethinking how we make &amp; use plastics. https://t.co/NUavRyEao2 https://t.co/MVwfFHhvri,2017-08-29 16:20:34,16,"[{'text': 'CircularDesign', 'indices': [33, 48]}]",2072,,Buffer,None,None,None
981,902432978193846272,New Plastics Economy,NewPlasticsEcon,5,Support for #NewPlasticsEconomy by @Veolia CEO Antoine Frerot. https://t.co/6SAIznuQO0,2017-08-29 07:29:23,8,"[{'text': 'NewPlasticsEconomy', 'indices': [12, 31]}]",2072,,Buffer,None,None,None
982,902261587846848513,New Plastics Economy,NewPlasticsEcon,10,Synergies between the New Plastics Economy and @UNEP's #CleanSeas campaign. @ErikSolheim https://t.co/sTqo6N0S7H,2017-08-28 20:08:20,14,"[{'text': 'CleanSeas', 'indices': [55, 65]}]",2072,,Buffer,None,None,None
983,902204221843542016,New Plastics Economy,NewPlasticsEcon,4,Can we make all plastic packaging recyclable? Find out about our #CircularMaterials challenge w. @NineSigma here: https://t.co/fnpx7QJEo5 https://t.co/2hkmctgc2o,2017-08-28 16:20:23,7,"[{'text': 'CircularMaterials', 'indices': [65, 83]}]",2072,,Buffer,None,None,None
984,902145255381848064,New Plastics Economy,NewPlasticsEcon,14,30% of plastic packaging needs fundamental redesign and innovation to be part of an effective system. https://t.co/1xCX7migFS https://t.co/rumYnNWpBI,2017-08-28 12:26:04,16,[],2072,,Buffer,None,None,None
985,901174387008823299,New Plastics Economy,NewPlasticsEcon,9,How do we keep plastics in the economy and out of the ocean? #NewPlasticsEconomy https://t.co/PFRlsmrFGj,2017-08-25 20:08:11,10,"[{'text': 'NewPlasticsEconomy', 'indices': [61, 80]}]",2072,,Buffer,None,None,None
986,901058250921168897,New Plastics Economy,NewPlasticsEcon,18,"Emmanuel Faber, CEO @Danone on why our $2M Innovation Prize is critical. https://t.co/EHHdLfdDsq",2017-08-25 12:26:42,29,[],2072,,Buffer,None,None,None
987,901020077092462593,New Plastics Economy,NewPlasticsEcon,1,"As a regenerative system, the #circulareconomy can have many positive consequences. #CircularDesign https://t.co/YAU18iwSI3 https://t.co/vOsO5qXURN",2017-08-25 09:55:01,9,"[{'text': 'circulareconomy', 'indices': [30, 46]}, {'text': 'CircularDesign', 'indices': [84, 99]}]",2072,,Buffer,None,None,None
988,900754650315542528,New Plastics Economy,NewPlasticsEcon,2,Why we need the $2M #NewPlasticsEconomy Innovation Prize. Watch Michiel De Smet's @TEDx talk. https://t.co/Hp8TWB3Oyq https://t.co/mOUbb7vgMa,2017-08-24 16:20:18,3,"[{'text': 'NewPlasticsEconomy', 'indices': [20, 39]}]",2072,,Buffer,None,None,None
989,900657725624942592,New Plastics Economy,NewPlasticsEcon,8,Our initiative looks at mechanisms to decouple the production of plastics from the consumption of finite resources. #NewPlasticsEconomy https://t.co/oRNGTiGl7B,2017-08-24 09:55:09,7,"[{'text': 'NewPlasticsEconomy', 'indices': [116, 135]}]",2072,,Buffer,None,None,None
990,900643361006268417,New Plastics Economy,NewPlasticsEcon,12,"RT @RobOpsomer: Aldi moves entirely to reusable bags, bans disposable bags. Important step towards a @NewPlasticsEcon! https://t.co/knL58Zr…",2017-08-24 08:58:05,0,[],2072,,Twitter Web Client,"Aldi moves entirely to reusable bags, bans disposable bags. Important step towards a @NewPlasticsEcon! https://t.co/knL58ZrrgD",None,None
991,900642815557988352,New Plastics Economy,NewPlasticsEcon,4,"RT @jossbleriot: We’ll be there, talking New #Plastics Economy - @NewPlasticsEcon https://t.co/hGmuWywhZV",2017-08-24 08:55:55,0,"[{'text': 'Plastics', 'indices': [45, 54]}]",2072,,Twitter Web Client,"We’ll be there, talking New #Plastics Economy - @NewPlasticsEcon https://t.co/hGmuWywhZV",None,None
992,900642283279790081,New Plastics Economy,NewPlasticsEcon,3,"RT @camucklow: Sharing work of @NewPlasticsEcon with other fantastic charities at #PPLgathering17 today, all possible thanks to players of…",2017-08-24 08:53:48,0,"[{'text': 'PPLgathering17', 'indices': [82, 97]}]",2072,,Twitter Web Client,"Sharing work of @NewPlasticsEcon with other fantastic charities at #PPLgathering17 today, all possible thanks to players of @PostcodeLottery",None,None
993,900620978165874688,New Plastics Economy,NewPlasticsEcon,6,Our $2M Innovation Prize aims to move the conversation towards upstream solutions and redesign. https://t.co/QD5EtPt3El #NewPlasticsEconomy https://t.co/y6FRIKO7w6,2017-08-24 07:29:08,2,"[{'text': 'NewPlasticsEconomy', 'indices': [120, 139]}]",2072,,Buffer,None,None,None
994,900392212319621123,New Plastics Economy,NewPlasticsEcon,8,"We need a different kind of thinking, fundamental innovation and a new approach to #plastics. #NewPlasticsEconomy https://t.co/fmbCqvzEED",2017-08-23 16:20:06,12,"[{'text': 'plastics', 'indices': [83, 92]}, {'text': 'NewPlasticsEconomy', 'indices': [94, 113]}]",2072,,Buffer,None,None,None
995,900333314661380098,New Plastics Economy,NewPlasticsEcon,2,We launched our $2M Innovation Prize w. support from @wenschmidt to tackle challenges like these. #CircularMaterials https://t.co/G2wBESU3PM https://t.co/bGDBeSBrol,2017-08-23 12:26:04,5,"[{'text': 'CircularMaterials', 'indices': [98, 116]}]",2072,,Buffer,None,None,None
996,900258563662241793,New Plastics Economy,NewPlasticsEcon,2,How might we get products to people without generating plastic waste? @OpenIDEO #CircularDesign https://t.co/RXfjHEmNfg https://t.co/8xTMw0svbf,2017-08-23 07:29:02,7,"[{'text': 'CircularDesign', 'indices': [80, 95]}]",2072,,Buffer,None,None,None
997,900087203661058049,New Plastics Economy,NewPlasticsEcon,6,Can we design a plastic system that works? #NewPlasticsEconomy https://t.co/0ifrP5nEBn,2017-08-22 20:08:06,8,"[{'text': 'NewPlasticsEconomy', 'indices': [43, 62]}]",2072,,Buffer,None,None,None
998,899970916347719680,New Plastics Economy,NewPlasticsEcon,2,Follow @NewPlasticsEcon to stay up-to-date with the latest news on our $2M Innovation Prize - https://t.co/q2BLR4WzpJ. https://t.co/qeFXIxg1nS,2017-08-22 12:26:01,3,[],2072,,Buffer,None,None,None
999,899932949344378880,New Plastics Economy,NewPlasticsEcon,6,How do we keep #plastics out of the ocean? Our initiative is made possible partly by the support of players of People's @PostcodeLottery. https://t.co/uaKldKbdDD,2017-08-22 09:55:09,16,"[{'text': 'plastics', 'indices': [15, 24]}]",2072,,Buffer,None,None,None
1000,899667430351548423,New Plastics Economy,NewPlasticsEcon,16,"We need to rethink and redesign the way we make, use and reuse plastics. #NewPlasticsEconomy https://t.co/FWb9x9FFU4",2017-08-21 16:20:05,15,"[{'text': 'NewPlasticsEconomy', 'indices': [73, 92]}]",2072,,Buffer,None,None,None
1001,899608534001778688,New Plastics Economy,NewPlasticsEcon,3,We're in the refinement phase of #CircularDesign challenge w. @OpenIDEO. More about the Innovation Prize. https://t.co/LmTjbmpbHL https://t.co/rozTC6uiQp,2017-08-21 12:26:03,11,"[{'text': 'CircularDesign', 'indices': [33, 48]}]",2072,,Buffer,None,None,None
1002,899570540368867328,New Plastics Economy,NewPlasticsEcon,16,How can we design a plastics system that works? #NewPlasticsEconomy https://t.co/q2BLR4WzpJ https://t.co/1bzUQkZRSM,2017-08-21 09:55:04,16,"[{'text': 'NewPlasticsEconomy', 'indices': [48, 67]}]",2072,,Buffer,None,None,None
1003,898580259527737344,New Plastics Economy,NewPlasticsEcon,4,"Our research suggests that tweaks to design and collection, combined with wider standardisation could yield significant economic benefits. https://t.co/I7XzIFqc9x",2017-08-18 16:20:03,8,[],2072,,Buffer,None,None,None
1004,898521378898432000,New Plastics Economy,NewPlasticsEcon,21,Reimagining the package. See 300+ of the contributions to our #CircularDesign challenge w. @OpenIDEO. https://t.co/uySjrplraI https://t.co/g7QyxRWOR9,2017-08-18 12:26:05,22,"[{'text': 'CircularDesign', 'indices': [62, 77]}]",2072,,Buffer,None,None,None
1005,898483391007522817,New Plastics Economy,NewPlasticsEcon,3,Our #CircularMaterials challenge asks innovators to find recyclable or industrially compostable materials. https://t.co/73iP4QNtUs https://t.co/lwW7I1hoic,2017-08-18 09:55:08,3,"[{'text': 'CircularMaterials', 'indices': [4, 22]}]",2072,,Buffer,None,None,None
1006,898217879165952000,New Plastics Economy,NewPlasticsEcon,8,At least a $10bn economic opportunity associated with the reuse of plastic packaging. #NewPlasticsEconomy https://t.co/LTVi5sEBhX https://t.co/kpWpGQB8Vv,2017-08-17 16:20:05,5,"[{'text': 'NewPlasticsEconomy', 'indices': [86, 105]}]",2072,,Buffer,None,None,None
1007,898159002089127937,New Plastics Economy,NewPlasticsEcon,8,Learn how to brainstorm ideas around the principles of circularity. #CircularDesign https://t.co/iquxPF7vY2 https://t.co/rztzr5OrHr,2017-08-17 12:26:07,8,"[{'text': 'CircularDesign', 'indices': [68, 83]}]",2072,,Buffer,None,None,None
1008,898084245561905152,New Plastics Economy,NewPlasticsEcon,6,Learn more about our $1M #CircularMaterials challenge launched with @NineSigma. https://t.co/9F9cYQeuun https://t.co/1bBs4d9103,2017-08-17 07:29:04,8,"[{'text': 'CircularMaterials', 'indices': [25, 43]}]",2072,,Buffer,None,None,None
1009,897912872763891714,New Plastics Economy,NewPlasticsEcon,7,"Infographic showing variety of plastic packaging, obvious challenges for design, collection, recycling and reuse. https://t.co/TtijNBJ7ly https://t.co/46iwGP5nPo",2017-08-16 20:08:05,12,[],2072,,Buffer,None,None,None
1010,897855496656478208,New Plastics Economy,NewPlasticsEcon,3,We had 150+ #CircularDesign challenge contributions focused on reimagining delivery models. @OpenIDEO https://t.co/E8e0HtHk00 https://t.co/1BipAVHuew,2017-08-16 16:20:06,7,"[{'text': 'CircularDesign', 'indices': [12, 27]}]",2072,,Buffer,None,None,None
1011,897758599312793601,New Plastics Economy,NewPlasticsEcon,1,Work towards a #NewPlasticsEconomy is made possible by supporters incl. players of People's @PostcodeLottery. https://t.co/q2BLR4WzpJ https://t.co/3DY46ZL595,2017-08-16 09:55:04,5,"[{'text': 'NewPlasticsEconomy', 'indices': [15, 34]}]",2072,,Buffer,None,None,None
1012,897493108044201984,New Plastics Economy,NewPlasticsEcon,0,Thanks to @wenschmidt &amp; Eric &amp; Wendy Schmidt Fund for Strategic Innovation for supporting our Innovation Prize. https://t.co/q2BLR4WzpJ https://t.co/CLbATgnka0,2017-08-15 16:20:06,1,[],2072,,Buffer,None,None,None
1013,897434210801156096,New Plastics Economy,NewPlasticsEcon,10,Negative external environmental impacts associated with the production of #plastics conservatively estimated by @UNEP at $40bn annually. https://t.co/Bfvlvm5YmK,2017-08-15 12:26:04,7,"[{'text': 'plastics', 'indices': [74, 83]}]",2072,,Buffer,None,None,None
1014,897396261338402821,New Plastics Economy,NewPlasticsEcon,6,"Love them or hate them, plastics are indispensable in our modern world. Why we need our $2M Innovation Prize: https://t.co/dmBXyMWN9r https://t.co/5UVBdzSxpw",2017-08-15 09:55:16,12,[],2072,,Buffer,None,None,None
1015,897188087088001026,New Plastics Economy,NewPlasticsEcon,47,"Despite 40 years of effort, only 14% of plastic packaging is collected for recycling. #NewPlasticsEconomy https://t.co/q2BLR4WzpJ https://t.co/UxtSPLUUWS",2017-08-14 20:08:03,24,"[{'text': 'NewPlasticsEconomy', 'indices': [86, 105]}]",2072,,Buffer,None,None,None
1016,897071833052323840,New Plastics Economy,NewPlasticsEcon,1,Look at the components of digital systems and imagine how you could design... #CircularDesign https://t.co/uWc6dgcopl https://t.co/nSObv6Rb0P,2017-08-14 12:26:06,3,"[{'text': 'CircularDesign', 'indices': [78, 93]}]",2072,,Buffer,None,None,None
1017,897033827218051073,New Plastics Economy,NewPlasticsEcon,22,We need to move upstream and fundamentally redesign plastic packaging. #NewPlasticsEconomy https://t.co/q2BLR4WzpJ https://t.co/YaPbuKl4Gl,2017-08-14 09:55:05,19,"[{'text': 'NewPlasticsEconomy', 'indices': [71, 90]}]",2072,,Buffer,None,None,None
1018,896043628161896449,New Plastics Economy,NewPlasticsEcon,2,. @amcorpackaging supports our $2M Innovation Prize and the #NewPlasticsEconomy initiative. https://t.co/81ek8prrFt,2017-08-11 16:20:23,7,"[{'text': 'NewPlasticsEconomy', 'indices': [60, 79]}]",2072,,Buffer,None,None,None
1019,895984732248428546,New Plastics Economy,NewPlasticsEcon,14,We need to fundamentally rethink how we make and use plastics. #NewPlasticsEconomy https://t.co/wTRdcFoiAK,2017-08-11 12:26:21,30,"[{'text': 'NewPlasticsEconomy', 'indices': [63, 82]}]",2072,,Buffer,None,None,None
1020,895946672718655488,New Plastics Economy,NewPlasticsEcon,12,Three strategies to catalyse action on plastic packaging endorsed by 40+ leading industry stakeholders. https://t.co/6qbZHQBUhw https://t.co/ma7YvjdjuE,2017-08-11 09:55:07,7,[],2072,,Buffer,None,None,None
1021,895681154338234372,New Plastics Economy,NewPlasticsEcon,13,A vision of a #plastics system that works. #NewPlasticsEconomy https://t.co/q2BLR4WzpJ https://t.co/U8FdY8zGXW,2017-08-10 16:20:02,17,"[{'text': 'plastics', 'indices': [14, 23]}, {'text': 'NewPlasticsEconomy', 'indices': [43, 62]}]",2072,,Buffer,None,None,None
1022,895622266188386304,New Plastics Economy,NewPlasticsEcon,4,Can we make all plastic packaging recyclable? Find out more about our #CircularMaterials challenge w. @NineSigma https://t.co/g8zCEsZyOC https://t.co/T9Ku8JM6yG,2017-08-10 12:26:02,5,"[{'text': 'CircularMaterials', 'indices': [70, 88]}]",2072,,Buffer,None,None,None
1023,895584284572078080,New Plastics Economy,NewPlasticsEcon,9,We need a new approach to breakthrough innovation for plastics. #NewPlasticsEconomy #CircularMaterials @NineSigma https://t.co/aP5zFfLTJQ https://t.co/HurdFdGsAt,2017-08-10 09:55:07,10,"[{'text': 'NewPlasticsEconomy', 'indices': [64, 83]}, {'text': 'CircularMaterials', 'indices': [84, 102]}]",2072,,Buffer,None,None,None
1024,895318815084433409,New Plastics Economy,NewPlasticsEcon,7,"Love them or hate them, plastics are all around us. Find out more about a vision for the #NewPlasticsEconomy. https://t.co/q2BLR4EY19 https://t.co/KPlJ42QreT",2017-08-09 16:20:14,9,"[{'text': 'NewPlasticsEconomy', 'indices': [89, 108]}]",2072,,Buffer,None,None,None
1025,895259900129021952,New Plastics Economy,NewPlasticsEcon,23,600+ ideas and solutions submitted in response to our #CircularDesign challenge w. @OpenIDEO. https://t.co/lo669k7Tml https://t.co/APSkdqxfdD,2017-08-09 12:26:07,28,"[{'text': 'CircularDesign', 'indices': [54, 69]}]",2072,,Buffer,None,None,None
1026,895185133782925313,New Plastics Economy,NewPlasticsEcon,0,Our $2M Innovation Prize is made possible by the support of the Eric &amp; Wendy Schmidt Fund for Strategic Innovation. https://t.co/6UqTuTfj1O https://t.co/HWr7gpySRp,2017-08-09 07:29:02,1,[],2072,,Buffer,None,None,None
1027,894956424262017025,New Plastics Economy,NewPlasticsEcon,0,How can we make all plastic packaging recyclable? Join the #CircularMaterials challenge w. @NineSigma https://t.co/mhJsoej1bi https://t.co/qRmxkmjuix,2017-08-08 16:20:13,5,"[{'text': 'CircularMaterials', 'indices': [59, 77]}]",2072,,Buffer,None,None,None
1028,894897504730349568,New Plastics Economy,NewPlasticsEcon,6,#NewPlasticsEconomy: Catalysing Action identifies the types of plastic packaging that require fundamental changes. https://t.co/Uy0Fqd9p8K https://t.co/095ScWZiUx,2017-08-08 12:26:06,5,"[{'text': 'NewPlasticsEconomy', 'indices': [0, 19]}]",2072,,Buffer,None,None,None
1029,894859507423203328,New Plastics Economy,NewPlasticsEcon,8,"Rethinking how we make, use and reuse plastic packaging. Find out more: https://t.co/JKeW7wBesL  #CircularMaterials @NineSigma https://t.co/XrSNXKbbKH",2017-08-08 09:55:06,8,"[{'text': 'CircularMaterials', 'indices': [97, 115]}]",2072,,Buffer,None,None,None
1030,894593994713432065,New Plastics Economy,NewPlasticsEcon,4,New 'Redesigning Plastics' lesson plan via @circulareconomy supports UN Global Goals.  https://t.co/RwaIqPdULh https://t.co/xTWOsRRB0Z,2017-08-07 16:20:03,6,[],2072,,Buffer,None,None,None
1031,894535095457112064,New Plastics Economy,NewPlasticsEcon,0,The #NewPlasticsEconomy initiative is made possible by the support of players of People's @PostcodeLottery. https://t.co/q2BLR4WzpJ https://t.co/SJwZK9n2u5,2017-08-07 12:26:01,0,"[{'text': 'NewPlasticsEconomy', 'indices': [4, 23]}]",2072,,Buffer,None,None,None
1032,894497104969773058,New Plastics Economy,NewPlasticsEcon,1,Have you ever stopped to wonder what's required to create our everyday products? #CircularDesign https://t.co/XgMmUY7Os1 https://t.co/p7gkioGcID,2017-08-07 09:55:03,1,"[{'text': 'CircularDesign', 'indices': [81, 96]}]",2072,,Buffer,None,None,None
1033,894479535563001858,New Plastics Economy,NewPlasticsEcon,0,@patty_moore @Gregcarrpk The full report is available for download here: https://t.co/NUrvCD0PgN,2017-08-07 08:45:14,1,[],2072,,Twitter Web Client,None,None,None
1034,893409936746700801,New Plastics Economy,NewPlasticsEcon,1,A blueprint for a #NewPlasticsEconomy. From the archives via @btschiller @FastCompany https://t.co/HBgQGQIzHZ https://t.co/ybjwecmDRV,2017-08-04 09:55:02,0,"[{'text': 'NewPlasticsEconomy', 'indices': [18, 37]}]",2072,,Buffer,None,None,None
1035,893144478491475969,New Plastics Economy,NewPlasticsEcon,5,M&amp;S and Unilever promise plastic redesign via @guardian https://t.co/Ccd6OJQofJ https://t.co/rE0nCvS2O1,2017-08-03 16:20:12,6,[],2072,,Buffer,None,None,None
1036,893085550068068352,New Plastics Economy,NewPlasticsEcon,2,New redesigning plastics lesson plan to support UN #GlobalGoals @TheWorldsLesson https://t.co/MStsY7vk0d https://t.co/lOYjjwJCar,2017-08-03 12:26:02,1,"[{'text': 'GlobalGoals', 'indices': [51, 63]}]",2072,,Buffer,None,None,None
1037,892766356722135040,New Plastics Economy,NewPlasticsEcon,27,RT @OpenIDEO: There's often some confusion about what #designthinking really is. @neilstevenson77 breaks it down for educators: https://t.c…,2017-08-02 15:17:40,0,"[{'text': 'designthinking', 'indices': [54, 69]}]",2072,,Twitter Web Client,There's often some confusion about what #designthinking really is. @neilstevenson77 breaks it down for educators: https://t.co/iNCBsakRWq https://t.co/LXWzGSAPRa,None,None
1038,892667114842140672,New Plastics Economy,NewPlasticsEcon,0,"@Gregcarrpk 32% refers to amount leaking into natural systems. 54% is ""thrown out"" to be landfilled/incinerated. Only 14% is collected for recycling.",2017-08-02 08:43:19,2,[],2072,,Twitter Web Client,None,None,None
1039,892427646268833797,New Plastics Economy,NewPlasticsEcon,2,The New Plastics Economy initiative is made possible by the support of the players of the People's @PostcodeLottery https://t.co/q2BLR4WzpJ,2017-08-01 16:51:46,9,[],2072,,Twitter Web Client,None,None,None
1040,892114663818899456,New Plastics Economy,NewPlasticsEcon,10,Find out more about the New Plastics Economy initiative and our research: https://t.co/q2BLR4WzpJ #NewPlasticsEconomy https://t.co/zjNrpkLaU6,2017-07-31 20:08:05,11,"[{'text': 'NewPlasticsEconomy', 'indices': [98, 117]}]",2072,,Buffer,None,None,None
1041,892057296355905537,New Plastics Economy,NewPlasticsEcon,20,30% of plastic packaging needs fundamental redesign &amp; innovation before it can be recycled. #CircularMaterials https://t.co/n8F7m8jg8S https://t.co/yIQTmwqtbf,2017-07-31 16:20:07,18,"[{'text': 'CircularMaterials', 'indices': [96, 114]}]",2072,,Buffer,None,None,None
1042,892046613027459072,New Plastics Economy,NewPlasticsEcon,0,"@gregorylent 40% is landfilled, 14% is landfilled, precise stat on leakage is 32%.",2017-07-31 15:37:40,0,[],2072,,Twitter Web Client,None,None,None
1043,891998382440546304,New Plastics Economy,NewPlasticsEcon,11,An ambitious vision for an economy where plastics are never viewed as waste. #NewPlasticsEconomy https://t.co/q2BLR4WzpJ https://t.co/qSjgI4JZP1,2017-07-31 12:26:01,16,"[{'text': 'NewPlasticsEconomy', 'indices': [77, 96]}]",2072,,Buffer,None,None,None
1044,891960389877075968,New Plastics Economy,NewPlasticsEcon,71,"Only 14% of plastics are collected for recycling, 30% leak into the environment - this is a depiction of an economy that doesn't work. https://t.co/2PfXE741wW",2017-07-31 09:55:03,84,[],2072,,Buffer,None,None,None
1045,891940587401859072,New Plastics Economy,NewPlasticsEcon,3,RT @suez: [To read] This is what a new #plastic economy could look like by @HuffPostUK @circulareconomy  @NewPlasticsEcon https://t.co/47NA…,2017-07-31 08:36:22,0,"[{'text': 'plastic', 'indices': [39, 47]}]",2072,,Twitter Web Client,[To read] This is what a new #plastic economy could look like by @HuffPostUK @circulareconomy  @NewPlasticsEcon https://t.co/47NABBE9Zt,None,None
1046,891940455142785024,New Plastics Economy,NewPlasticsEcon,6,RT @OpenIDEO: The #CircularDesign Challenge Ideas Phase closed with 650+ creative ideas. Take time to explore them all here: https://t.co/i…,2017-07-31 08:35:50,0,"[{'text': 'CircularDesign', 'indices': [18, 33]}]",2072,,Twitter Web Client,The #CircularDesign Challenge Ideas Phase closed with 650+ creative ideas. Take time to explore them all here: https://t.co/iV0SfsWSmb https://t.co/wyq1SRS0El,None,None
1047,891923671769632768,New Plastics Economy,NewPlasticsEcon,18,Can we make all plastic packaging recyclable? Looking for the answer w. @circulareconomy &amp; @NineSigma. https://t.co/6YJ0Phq87I https://t.co/ncF9kbIuV2,2017-07-31 07:29:09,22,[],2072,,Buffer,None,None,None
1048,890970113498910720,New Plastics Economy,NewPlasticsEcon,10,"We need to look for solutions upstream, rather than focusing on end-of-pipe solutions only. https://t.co/q2BLR4WzpJ https://t.co/MnTD5fPpsh",2017-07-28 16:20:03,15,[],2072,,Buffer,None,None,None
1049,890911236954738688,New Plastics Economy,NewPlasticsEcon,2,#NewPlasticsEconomy is an ambitious 3yr initiative aiming to fundamentally rethink how we make &amp; use plastics. https://t.co/q2BLR4WzpJ https://t.co/agYoZJ4Y7a,2017-07-28 12:26:05,19,"[{'text': 'NewPlasticsEconomy', 'indices': [0, 19]}]",2072,,Buffer,None,None,None
1050,890873220798271488,New Plastics Economy,NewPlasticsEcon,2,"At 11:30pm PST today, the ideas phase of the #CircularDesign challenge closes. Don't miss out: https://t.co/tvInywPtGc https://t.co/1gf4Xu7PnD",2017-07-28 09:55:02,0,"[{'text': 'CircularDesign', 'indices': [45, 60]}]",2072,,Buffer,None,None,None
1051,890836740046454785,New Plastics Economy,NewPlasticsEcon,6,Why the #circulareconomy is ultimately still about responding to users' needs. #CircularDesign #NewPlasticsEconomy https://t.co/E2tkeOqKe1,2017-07-28 07:30:04,6,"[{'text': 'circulareconomy', 'indices': [8, 24]}, {'text': 'CircularDesign', 'indices': [79, 94]}, {'text': 'NewPlasticsEconomy', 'indices': [95, 114]}]",2072,,Buffer,None,None,None
